recipe_name,ingredients,directions
Slow Cooker Cranberry Fig Pork,"4 (4 ounce) pork chops, 1 cup frozen cranberries, 3  canned figs, 1/4 cup juice reserved, Â½ cup apple juice, 2 tablespoons brown sugar, Â¼ teaspoon salt, Â¼ teaspoon ground black pepper, Â¼ teaspoon dried rosemary","Heat a skillet over medium-high heat. Sear pork chops in the hot skillet until lightly browned, about 1 minute per side. Transfer seared pork chops to the slow cooker.
Combine cranberries, figs, reserved fig juice, apple juice, brown sugar, salt, black pepper, and rosemary in a saucepan; bring to a boil. Pour cranberry mixture over pork chops.
Cook on High for 4 hours."
Dolce Pesca (Sweet Peaches),"4  fresh figs, Â½ cup pine nuts, 4  peaches, halved and pitted, Â¼ cup white sugar, 1 cup white wine, Â½ cup brandy","Preheat an oven to 375 degrees F (190 degrees C). Line a baking sheet with foil.
Place the figs and pine nuts in the bowl of a food processor and pulse until fine. Place the halved peaches onto the prepared baking sheet, cut side up. Sprinkle evenly with the white sugar. Pour the white wine over the peaches, and stuff them with the fig mixture. Pour the brandy over the peaches.
Bake in the preheated oven until browned, about 15 minutes."
Simple Cantaloupe Smoothie,"1 cup vanilla yogurt (such as DannonÂ® Light and FitÂ®), Â½ cup orange juice, Â½ cup sliced cantaloupe, 4  ice cubes, crushed, or as needed","Blend yogurt, orange juice, cantaloupe, and ice cubes in a blender until smooth, about 30 seconds."
Watermelon Lemonade,"Â½ cup white sugar, Â½ cup water, 4 cups cubed watermelon, 3 cups cold water, Â½ cup fresh lemon juice, 6 cups ice cubes","Place the watermelon into a blender. Cover, and puree until smooth. Strain through a fine mesh sieve.
Bring sugar and 1/2 cup water to a boil in a saucepan over medium-high heat until sugar dissolves, about 5 minutes. Remove from heat. Stir in 3 cups of cold water and the lemon juice. Divide the ice into 12 glasses, and scoop 2 to 3 tablespoons of watermelon puree over the ice, then top with the lemonade. Gently stir before serving."
Watermelon Ice Pops,"1 Â½ cups watermelon, seeded and diced, Â½ cup water, 1 tablespoon honey, 1 tablespoon fresh lemon juice, 1 tablespoon white sugar","Blend watermelon, water, honey, lemon juice, and sugar together in a blender until smooth. Pour mixture into ice pop molds and freeze until solid, about 2 hours.
Run hot water over ice pop molds for a few seconds to unmold."
Tomato Watermelon Salad,"1 large seedless watermelon, cut into 1-inch cubes, 4  tomatoes, cut into 1-inch dice, 1 cup crumbled feta cheese, 1 large sweet onion, thinly sliced, 12  mint leaves, sliced thinly, Â¼ cup olive oil, 2 tablespoons white balsamic vinegar, 1 pinch coarse salt, or to taste, 1 pinch ground black pepper, or to taste","Gently mix watermelon, tomatoes, feta cheese, onion, and mint in a large bowl.
Whisk olive oil, vinegar, salt, and pepper together in a small bowl; drizzle over salad and gently toss to coat."
Melon Smoothie,"Â¼  cantaloupe - peeled, seeded and cubed, Â¼  honeydew melon - peeled, seeded and cubed, 1  lime, juiced, 2 tablespoons sugar","In a blender, combine cantaloupe, honeydew, lime juice and sugar. Blend until smooth. Pour into glasses and serve."
Watermelon Milkshake,"1 Â½ cups diced watermelon, 2 Â¼ cups milk, 2 teaspoons white sugar",Process the watermelon and milk together in a blender until smooth. Add the sugar and blend another 10 seconds to incorporate. Serve immediately.
Simple Watermelon Sorbet,"1 cup white sugar, Â½ cup water, Â¼ cup lemon juice, 3 cups cubed seeded watermelon","Combine sugar, water, and lemon juice in a saucepan over medium heat; cook and stir until sugar is dissolved, about 5 minutes. Remove from heat and refrigerate until cooled, about 30 minutes.
Blend watermelon in a blender or food processor until pureed. Stir pureed watermelon into sugar mixture. Transfer watermelon mixture to an ice cream maker and freeze according to manufacturer's instructions."
Refreshing Cucumber Watermelon Salad,"1 small red onion, halved and sliced into thin half-moons, 2 tablespoons lime juice, or more to taste, 2 tablespoons extra-virgin olive oil, 1  seedless watermelon, cut into cubes, 3  baby cucumbers, seeded and cut into cubes, 1 cup crumbled feta cheese, Â½ cup mint leaves, sliced thinly","Mix red onion with lime juice in a bowl; set side to marinate at least 10 minutes. Stir olive oil into mixture.
Toss watermelon, baby cucumbers, and feta cheese together in a large bowl. Pour the red onion mixture over the watermelon mixture; toss to coat. Sprinkle mint over the salad; toss."
Refreshing Watermelon Salad,"3 tablespoons lime juice, 1 cup sliced red onion, cut lengthwise, 15 cups cubed watermelon, 3 cups cubed English cucumber, 1 (8 ounce) package feta cheese, crumbled, Â½ cup chopped fresh cilantro,   cracked black pepper,   sea salt","In a small bowl, pour lime juice over red onions. Allow to marinate while assembling the salad.
Gently combine the watermelon, cucumber, feta cheese, and cilantro in a large bowl. Season with black pepper. Toss watermelon salad with marinated onions and season with sea salt just before serving.











CookinBug
"
Watermelon Basil Salad,"Â¼ cup basil leaves, 4 cups 1/2-inch cubes watermelon, 2 teaspoons lemon juice, Â¼ teaspoon kosher salt, Â¼ teaspoon chili powder","Stack basil leaves on top of each other and roll tightly into a log. Slice lengthwise into thin ribbons.
Combine basil slices and watermelon in a large bowl. Drizzle lemon juice over watermelon.
Mix salt and chili powder together in a small bowl; sprinkle over watermelon and toss to combine. Chill salad before serving, at least 30 minutes."
Spicy Watermelon,"Â¼ teaspoon ground cumin, Â¼ teaspoon ground coriander, Â¼ teaspoon chili powder, Â¼ teaspoon salt, â…?teaspoon cayenne pepper, 2 cups cubed seeded watermelon, Â½  lime, juiced","Mix cumin, coriander, chili powder, salt, and cayenne pepper together in a bowl.
Place watermelon into serving bowls; sprinkle with spice mixture. Squeeze lime juice over spiced watermelon."
Watermelon Sherbet,"4 cups diced seedless watermelon, 1 cup white sugar, 3 tablespoons lemon juice, 1 dash salt, Â¼ cup cold water, 1 (.25 ounce) envelope unflavored gelatin, 1 cup chilled heavy cream","Combine the watermelon, sugar, lemon juice, and salt in a large mixing bowl; stir to coat evenly. Cover the bowl with plastic wrap and refrigerator for 30 minutes.
Blend the mixture in a blender until smooth; return to the bowl.
Pour the cold water into a saucepan. Sprinkle the gelatin over the cold water; let stand 1 minutes. Place the saucepan over low heat; cook for 2 minutes. Stir the gelatin mixture into the blended watermelon mixture. Add the heavy cream; beat with an electric hand mixer at medium speed until the mixture is fluffy.
Transfer the mixture into an ice cream maker and freeze according to manufacturer's directions until it reaches soft-serve consistency. Transfer ice cream to a one- or two-quart lidded plastic container; cover surface with plastic wrap and seal. For best results, ice cream should ripen in the freezer for at least 2 hours or overnight."
Watermelon Caprese Appetizer,"3 sprigs fresh basil, stems removed, 1 small watermelon, fruit removed with a melon baller, 1 (8 ounce) package fresh mozzarella cheese, cut into small pieces, 2 tablespoons olive oil, 2 tablespoons balsamic vinegar,   salt and ground black pepper to taste","Trim basil leaves into small circles about 1 inch in diameter.
Thread watermelon and mozzarella cheese on toothpicks, sandwiching a basil leaf in between. Arrange on a serving plate.
Pour olive oil and balsamic vinegar over toothpicks. Sprinkle salt and black pepper on top.









"
Watermelon Soup,"4 cups cubed seeded watermelon, 2 tablespoons lemon juice, 1 tablespoon chopped fresh mint, 1 tablespoon honey","Blend watermelon, lemon juice, mint, and honey in a blender until smooth. Refrigerate 2 hours before serving."
Watermelon and Feta Salad with Arugula and Spinach,"3 tablespoons extra-virgin olive oil, 2 teaspoons white balsamic vinegar, Â½ teaspoon kosher salt, 2 cups arugula, 2 cups baby spinach leaves, 1 cup thinly sliced red onion, 1 cup grape tomatoes, halved, Â½ cup crumbled feta cheese, 2 cups bite sized watermelon chunks","Whisk the olive oil, white balsamic vinegar, and salt together in a small bowl; set aside.
Combine the arugula, spinach, onions, and tomatoes in a large salad bowl. Drizzle the vinaigrette over the salad mixture; toss to coat. Add the feta cheese and watermelon to serve."
Watermelon Feta Salad,"3 tablespoons olive oil, 2 teaspoons white balsamic vinegar, Â½ teaspoon kosher salt, 8 ounces grape tomatoes, halved, 3 cups arugula, 1 cup sliced red onion, 2 pounds watermelon, cubed, 4 ounces feta cheese, cut into 1/4-inch cubes","Whisk olive oil, vinegar, and salt together in a large mixing bowl. Add tomatoes, arugula, and red onion; toss to coat. Gently stir in watermelon and feta cheese to serve."
Jewel's Watermelon Margaritas,"Â½ cup white sugar, Â½ cup water, 3 strips orange zest, 2 cups cubed seeded watermelon, Â¾ cup white tequila, Â¼ cup lime juice, 1 pinch salt or sugar for rimming glasses, 1  lime, cut into wedges, 2 cups crushed ice, or as needed","Bring 1/2 cup sugar, water, and orange zest in a small saucepan to boil, stirring constantly. Simmer until sugar is dissolved, about 3 minutes. Remove simple syrup from heat and allow to cool completely.
Place watermelon in a blender or food processor. Pulse until pureed.
Stir watermelon puree into a large pitcher with simple syrup, tequila, and lime juice.
Place a small amount of salt or sugar into a saucer. Rub edge of margarita glasses with a lime wedge to moisten. Lightly dip the rim of the glass into the saucer to rim the glass; tap off excess salt or sugar.
Fill rimmed glasses with crushed ice; pour margarita mixture into glasses and garnish with lime wedges to serve.











France C
"
Watermelon Preserves,"2 pounds watermelon, 3 cups white sugar, 3  lemons - rinsed, sliced and seeded","Remove the green rind from watermelon, and dice white part into small cubes, leaving the red flesh mostly intact. Remove seeds.
In a heavy stockpot, combine 4 cups of prepared watermelon, sugar, and lemons. Bring to a boil over medium heat, and let the mixture boil slowly for 2 hours, stirring occasionally. The temperature of the mixture should be at 220 degrees F (105 degrees C) so the jam will set.
Sterilize the jars and lids in boiling water for at least 5 minutes. Pack the jam into the hot, sterilized jars, filling the jars to within 1/4 inch of the top. Run a knife or a thin spatula around the insides of the jars after they have been filled to remove any air bubbles. Wipe the rims of the jars with a moist paper towel to remove any food residue. Top with lids, and screw on rings.
Place a rack in the bottom of a large stockpot and fill halfway with water. Bring to a boil over high heat, then carefully lower the jars into the pot using a holder. Leave 2 inches of space between the jars. Pour in more boiling water if necessary until the water level is at least 1 inch above the tops of the jars. Bring the water to a full boil, cover the pot, and process for 10 minutes.
Remove the jars from the stockpot and let rest, several inches apart, for 12 to 24 hours. Press the center of each lid with a finger to ensure the lid does not move up or down. Remove the rings for storage and store in a cool, dark area."
Herb Watermelon Feta Salad,"Â½ large chilled seedless watermelon, cut into 1-inch cubes, 1 small red onion, sliced, 1 cup thinly sliced fresh basil leaves, 1 cup chopped fresh cilantro, Â½ cup minced fresh mint leaves, 2  limes, juiced, 1 (4 ounce) package crumbled feta cheese, 3 tablespoons olive oil, 2 tablespoons balsamic vinegar, or more to taste,   salt and ground black pepper to taste","Gently toss watermelon, onion, basil, cilantro, mint, lime juice, feta cheese, olive oil, balsamic vinegar, salt, and black pepper together in a large bowl."
Polynesian Watermelon Drink ('Otai),"1  seedless watermelon, halved and sliced, 3 cups water, 1 (15.25 ounce) can crushed pineapple, 1 (12 fluid ounce) can evaporated milk, Â½ cup shredded coconut, 2 tablespoons white sugar, or to taste, Â½  lime, juiced","Grate watermelon with a fork from the rind into a large bowl, leaving no large chunks. Stir water, pineapple, evaporated milk, and coconut into the grated watermelon. Add sugar; stir until dissolved. Squeeze lime juice into the watermelon mixture."
"Summer Fruit Salad with a Lemon, Honey, and Mint Dressing","4 cups cubed seeded watermelon, 2 cups sliced fresh strawberries, 2 large  fresh peaches, cut into cubes, 2 large  nectarines, cut into cubes, 1  red Anjou pear, cut into cubes, 1 cup seedless grapes, halved, 2  lemons, juiced, Â¼ cup minced fresh mint (chocolate mint preferred), Â½  lemon, zested, 1 tablespoon honey (fireweed honey preferred)","Combine watermelon, strawberries, peaches, nectarines, pear, and grapes in a large mixing bowl.
Whisk lemon juice, mint, lemon zest, and honey together in a small bowl; drizzle over the fruit mixture and toss to coat.
Refrigerate 1 hour before serving."
100% Fruit Cake,"1  seedless watermelon, 2 cups strawberries, hulled and sliced, 1  cantaloupe - seeded, peeled, and sliced (Optional), 1  fresh pineapple - peeled, cored, and sliced (Optional)","To create the base tier of the cake, cut 3 slices of watermelon, 1 to 2 inches thick, crossways through the center of the melon. Trim the rind from the watermelon slices, and place the largest slice onto a cake plate. Alternate layering sliced strawberries, slices of cantaloupe, and slices of fresh pineapple; follow with the second-largest watermelon slice. Repeat once more to make a layered fruit stack that looks like a cake.
Thinly slice a few pieces of remaining melon and pineapple. With cookie cutters or a sharp knife, cut remaining fruit slices into decorative shapes. Decorate the cake tiers with the cut fruit shapes and remaining berries.
Refrigerate until serving time. To serve, slice the cake with a sharp knife, one wedge at a time, and set the wedge onto a plate."
Watermelon Lime Agua Fresca,"8 cups water, divided, 5 cups peeled, cubed, and seeded watermelon, Â½ cup white sugar, or more to taste, â…?cup lime juice, or more to taste","Combine 1 cup water, watermelon, and sugar in a blender; process until smooth. Pour into a large pitcher; stir in lime juice and remaining 7 cups water. Taste; adjust sugar or lime juice. Refrigerate until chilled, about 1 hour."
Watermelon Goat Cheese Salad,"Â¼ cup extra-virgin olive oil, 2 tablespoons lemon juice, 2 tablespoons red wine vinegar, Â¼ teaspoon salt,   Ground pepper, to taste, 4 cups spring mix, 4 cups seedless watermelon, diced, Â½ (4 ounce) log MontchevreÂ® honey goat cheese , Â½ cup hazelnuts, chopped","Whisk together olive oil, lemon juice, vinegar, salt, and pepper.
In a large bowl, gently toss spring mix and watermelon together with vinaigrette.
Top with goat cheese and hazelnuts to serve."
Watermelon Fruit Bowl,"1  large watermelon, 1  cantaloupe, halved and seeded, 1  honeydew melon, halved and seeded, 2 (15 ounce) cans mandarin oranges, drained, 2 (20 ounce) cans pineapple chunks, drained, 2 cups halved fresh strawberries, 2 cups seedless grapes , Â½ cup water, Â¼ cup white sugar, 2 tablespoons grated lemon zest","With a large, sharp knife, remove the top 1/4 section of the watermelon. With a melon baller, scoop flesh from inside of watermelon, removing as many seeds as possible. Leave 1/2 inch of flesh inside the shell of the watermelon. Scoop cantaloupe and honeydew in the same manner, removing as much flesh as possible, and discarding the rinds. Refrigerate fruits separately until ready to assemble.
In a small saucepan over medium-high heat, bring water and sugar to a boil. Remove from heat, and continue stirring until sugar has completely dissolved. Add lemon zest, and set aside to cool.
To serve, place watermelon balls, cantaloupe, honeydew, oranges, pineapple, strawberries, and grapes, in a large mixing bowl. Pour syrup over, and toss thoroughly. Transfer mixture to watermelon bowl, and serve. Set aside any fruit mixture that will not fit. There will be enough fruit to refill the bowl."
Watermelon and Cucumber Juice with a Spritz of Lime,"Â½ (4 pound) watermelon, seeded and cubed, 4  cucumbers, trimmed and cut into chunks, 2  limes, juiced","Run watermelon and cucumber pieces through a juicer following the manufacturer's instructions, and place the juice into a pitcher. Stir in lime juice, and serve.











Melissa Goff
"
Heavenly Honeydew Juice,"1 (5 pound) honeydew melon, quartered and seeded, 2 cups ice cubes, 1 cup water, 3 tablespoons white sugar","Scrape flesh from honeydew melon quarters into a blender; add ice cubes, water, and sugar. Blend until smooth and sugar has dissolved. Serve immediately."
Watermelon Summer Salad,"Â¾ cup halved, thinly sliced red onion, 1 tablespoon fresh lime juice, 1 Â½ quarts seeded, cubed watermelon, Â¾ cup crumbled feta cheese, Â½ cup pitted black olive halves, 1 cup chopped fresh mint, 2 tablespoons olive oil","Place the onion slices in a small bowl with the lime juice. The acid of the lime will mellow the flavor of the raw onion. Let stand for 10 minutes.
In a large bowl, combine the watermelon cubes, feta cheese, black olives, onions with the lime juice, and mint. Drizzle olive oil over it all, and toss to blend. Dig in and be prepared for a pleasant surprise!"
Cantaloupe Crunch,"3 cups cubed cantaloupe, Â½ cup white sugar, â…?cup lemon juice, 2 tablespoons unsalted butter, melted, 1 tablespoon all-purpose flour, Â½ teaspoon vanilla extract, Â½ teaspoon ground cinnamon, Â¼ teaspoon ground nutmeg, 1 (15.25 ounce) package white cake mix, Â½ cup unsalted butter, melted","Preheat the oven to 350 degrees F (175 degrees C).
Mix cantaloupe, sugar, lemon juice, 2 tablespoons melted butter, flour, vanilla, cinnamon, and nutmeg together in a medium bowl. Pour into a 9-inch square baking dish.
Spread dry cake mix evenly over cantaloupe mixture, then drizzle 1/2 cup melted butter over top.
Bake in the preheated oven until golden brown, about 45 minutes."
Chewy Watermelon Rind Candy,"1  watermelon rind, peeled, 4 cups water, 4 cups white sugar, Â½ cup spearmint leaves, coarsely chopped, 1 tablespoon dried sweet basil","Cut watermelon rind into 2-inch long, 1-inch wide, and 1/2-inch thick pieces.
Combine water, sugar, spearmint, and basil in a large pot. Bring to a rolling boil. Strain out spearmint and basil. Add watermelon rind, making sure pieces are completely immersed. Cook until rind is soft, about 5 minutes.
Drain watermelon pieces and arrange in a single layer on dehydrator trays. Dry according to manufacturer's instructions until pieces are candied and dried, 6 to 8 hours."
Watermelon Margaritas,"2 cups cubed seeded watermelon, 2 cups crushed ice, â…?cup tequila, Â¼ cup white sugar, Â¼ cup lime juice, 1 tablespoon vodka, 1 tablespoon orange liqueur ","Combine watermelon, ice, tequila, sugar, lime juice, vodka, and orange liqueur in a blender; blend well. Pour margaritas into glasses."
Watermelon Cooler Slushy,"4 cups cubed seedless watermelon, 10  ice cubes, â…?cup fresh lime juice, Â¼ cup white sugar, â…?teaspoon salt","Place watermelon and ice into a blender. Pour in lime juice, sugar, and salt. Blend until smooth."
Quick Cantaloupe Juice,"Â½  cantaloupe - peeled, seeded, and cubed, Â¾ cup milk, 1 tablespoon white sugar",Place cantaloupe in a blender and top with milk and sugar. Cover and blend until smooth.
Watermelon Rind Candy,"2 Â½ gallons water, 1 tablespoon salt, 2 gallons watermelon rind, white part only, cut into 1-inch cubes, 1 quart cider vinegar, 26 cups white sugar, divided, 28  whole cloves, 14 (3 inch) cinnamon stick","Bring the water and salt to a boil in a large, enamel stockpot over high heat. Add the watermelon rinds, and return to a boil. Cook for 20 minutes, then drain the rinds in a colander. Bring the vinegar to a boil with 6 cups of sugar. Remove from the heat, stir in the watermelon rinds, cover, and let stand overnight.
The following day, remove the rinds from the syrup using a slotted spoon, and place them into a clean bowl. Set the stockpot onto the stove over high heat, add 4 cups of sugar, and return the syrup to a boil. Once the sugar has dissolved, remove the stockpot from the heat, and stir in the watermelon rinds, cover, and let stand overnight.
On day 3, repeat the process above, using only 2 cups of sugar: remove the rinds from the syrup using a slotted spoon, and place them into a clean bowl. Set the stockpot onto the stove over high heat, add 2 cups of sugar, and return the syrup to a boil. Once the sugar has dissolved, remove the stockpot from the heat, and stir in the watermelon rinds, cover, and let stand overnight. Repeat step 3 every day for 6 more days.
On day 10, sterilize the canning jars, rings and lids in boiling water. Pack the watermelon rinds into sterilized jars, making sure there are no spaces or air pockets on the sides. Add two cloves and one cinnamon stick to each jar. Return the syrup to a boil, and fill the jars to within 1/4 inch of the top. Top with lids, and screw on rings.
Place a rack in the bottom of a large stockpot and fill halfway with boiling water. Carefully lower jars into pot using a holder. Leave a 2 inch space between jars. Pour in more boiling water if necessary, until tops of jars are covered by 2 inches of water. Bring water to a full boil, cover the pot, and process for 10 to 15 minutes. Remove the stockpot from the heat, and let the jars stand in the water for 2 hours off of the heat.
Remove the jars from the stockpot and place onto a cloth-covered or wood surface, several inches apart, until cool. Once cool, press the top of each lid with a finger, ensuring that the seal is tight (lid does not move up or down at all). Store in a cool, dark area for 2 weeks before opening."
Agua Fresca,"1 Â½ cups water, 3 slices cantaloupe, peeled and seeded, 6 tablespoons white sugar, 1 cup ice cubes","Place water, cantaloupe, and sugar in a blender; blend until smooth. Divide ice into two glasses and pour cantaloupe mixture over ice."
Watermelon-Cucumber Agua Fresca,"4 cups cubed seeded watermelon, 2 Â½ cups water, divided, 1 cup peeled, chopped cucumber, Â¼ cup freshly squeezed lime juice, 1 tablespoon white sugar, 1 teaspoon chili-lime seasoning (such as TajinÂ®), 1 wedge fresh lime,   ice as needed, 4 slices watermelon, 4 slices  lime","Place watermelon and 1 1/2 cups water in a blender, and process at high speed until combined, about 1 minute. Add cucumber, lime juice, and sugar; blend until smooth. Pour mixture through a fine mesh strainer and using a spatula, press to remove the pulp. Don't skip this step, it's important.
Pour the strained mixture into a large pitcher, add remaining 1 cup water, and stir well. Refrigerate for at least 1 hour or longer.
Sprinkle some TajinÂ® (chili lime seasoning) onto a small plate. Run the lime wedge around the top of the glass, invert the glass, and dip the rim into the seasoning.
Fill the glass with ice, pour in the agua fresca, garnish with watermelon slices or wedges, and lime slices."
Watermelon and Strawberry Lemonade,"8 cups cubed seeded watermelon, 1 cup fresh strawberries, halved, Â½ cup fresh lemon juice, 1 cup white sugar, 2 cups water","Combine watermelon, strawberries, lemon juice, sugar, and water in a blender. Blend until smooth."
Cantaloupe Bread with Praline Glaze,"2 cups white sugar, 2 cups cantaloupe - peeled, seeded and pureed, 1 cup vegetable oil, 3 large eggs, 1 tablespoon vanilla extract, 3 cups all-purpose flour, 2 teaspoons ground cinnamon, 1 teaspoon baking soda, 1 teaspoon salt, Â¾ teaspoon baking powder, Â½ teaspoon ground ginger","Preheat the oven to 325 degrees F (165 degrees C). Lightly grease and flour two 9x5-inch loaf pans.
Beat together sugar, purÃ©ed cantaloupe, oil, eggs, and vanilla in a large bowl until well combined. Sift together flour, cinnamon, baking soda, salt, baking powder, and ginger in a separate bowl. Stir flour mixture into cantaloupe mixture until combined. Divide batter evenly between the prepared pans.
Bake in the preheated oven until a toothpick inserted into the centers of loaves comes out clean, about 1 hour.
Meanwhile, make sauce: Combine brown sugar and butter in a microwave-safe bowl. Cook in the microwave for 3 minutes, stirring at 1-minute intervals. Mix in pecans.
Pour sauce over warm loaves. Let cool for 1 hour before serving."
Watermelon Pie,"1 (3 ounce) package watermelon flavored Jell-OÂ®, Â¼ cup water, 1 (12 ounce) container frozen whipped topping, thawed, 2 cups watermelon, 1 (9 inch) prepared graham cracker crust","Mix together the watermelon gelatin and water. Fold gelatin mixture into the dessert topping. Add cut watermelon.
Pour mixture into graham cracker crust. Cool in refrigerator for about 3 hours."
