recipe_name,ingredients,directions
Lamb Braised in Pomegranate,"3 pounds lamb shoulder blade chops,   salt and freshly ground pepper to taste, 1 tablespoon vegetable oil, 1  onion, sliced, 1 pinch salt, 4 cloves garlic, sliced, 2 cups pomegranate juice, â…?cup aged balsamic vinegar, 8  fresh mint leaves, Â¼ teaspoon dried rosemary, Â¼ teaspoon red pepper flakes, 1 tablespoon honey, or more to taste, 2 tablespoons pomegranate seeds, 1 tablespoon sliced fresh mint leaves, 1 tablespoon pumpkin seeds","Preheat the oven to 300 degrees F (150 degrees C).
Generously season lamb chops with salt and black pepper.
Heat vegetable oil in a Dutch oven over high heat. Place lamb chops in Dutch oven and cook until browned on all sides, about 8 minutes. Transfer lamb to a plate and reduce heat to medium.
Stir onion and a pinch of salt into the Dutch oven; cook until onions are slightly golden, about 3 minutes. Stir in garlic and cook for 30 seconds.
Pour pomegranate juice into the Dutch oven and scrape any browned bits off of the bottom of the pot. Pour in balsamic vinegar, increase heat to high, and bring to a boil.
Stir mint leaves, rosemary, and red pepper flakes into pomegranate juice mixture. Continue to boil until liquid is reduced by half, about 10 minutes. Return lamb and any accumulated juices to the Dutch oven, spoon pomegranate mixture over lamb, and cover.
Cook in the preheated oven until lamb is fork tender, about 2 hours.
Transfer lamb to a plate and set the Dutch oven on the stovetop over high heat. Bring pomegranate mixture to a boil; cook, skimming any fat that accumulates, until liquid is reduced by 1/3, about 5 minutes.
Stir in honey and season with salt and black pepper. Return lamb to the Dutch oven; stir to combine. Garnish with pomegranate seeds, sliced mint leaves, and pumpkin seeds.











Chef John/Allrecipes
"
Pomegranate Molasses Barbecue Sauce,"1 Â½ tablespoons dark soy sauce, 2 tablespoons ketchup, 2 tablespoons pomegranate molasses, 2 tablespoons honey, 1 tablespoon sunflower seed oil, 1 teaspoon smooth mustard, 1 clove garlic, minced, Â¼ teaspoon sea salt, Â¼ teaspoon coarsely ground black pepper, Â¼ teaspoon ground paprika","In a bowl, stir together the soy sauce, ketchup, pomegranate molasses, honey, sunflower seed oil, mustard, garlic, sea salt, black pepper, and paprika to make a smooth paste."
Yummy Pomegranate Vinaigrette Dressing,"1 cup olive oil, 1 cup pomegranate juice, 1 cup rice vinegar, Â¼ cup white sugar, 2 tablespoons chopped shallots, 1 Â¼ teaspoons chopped garlic, 1 teaspoon ground white pepper,   kosher salt to taste","Place olive oil, pomegranate juice, rice vinegar, white sugar, shallots, garlic, white pepper, and salt in a blender. Blend until smooth, about 2 minutes."
Middle Eastern Rice Pilaf with Pomegranate,"2 tablespoons olive oil, 1  onion, finely chopped, 1 cup long-grain rice, 2 Â¼ cups hot vegetable broth, 4  saffron threads, 1 pinch ground allspice, 3 tablespoons unsalted shelled pistachios, 1 tablespoon butter, 1 large pomegranate, peeled and seeds separated,   salt and freshly ground black pepper","Heat oil in a saucepan over medium heat and cook onion until soft and translucent. Add rice and toast until fragrant, 2 to 3 minutes. Pour in hot vegetable broth and bring to a boil. Add saffron and allspice, reduce heat to medium-low, cover, and simmer until rice is tender and liquid has been absorbed, about 20 minutes.
Toast pistachios in a skillet over medium heat until nuts start to turn golden brown and become fragrant, 5 to 10 minutes. Set aside.
Stir butter into the cooked rice. Remove from heat and mix in pistachios and pomegranate seeds. Fluff with fork and season with salt and pepper."
Pear and Pomegranate Salad,"3 cups green leaf lettuce, rinsed and torn, 1  Bartlett or Anjou pear, â…?cup pomegranate seeds, 1 tablespoon vegetable oil, 2 tablespoons pomegranate juice, 1 tablespoon lemon juice, 1 teaspoon prepared Dijon-style mustard, Â½ tablespoon honey,   ground black pepper to taste","Divide the lettuce between two bowls. Halve and core the pear, then cut each half in slices. Divide the pear slices and pomegranate seeds among the two bowls and mix gently.
Combine the vegetable oil, pomegranate juice, lemon juice, mustard, honey, and pepper in a saucepan. Bring to a boil over high heat; reduce heat and simmer, stirring frequently, until the dressing thickens slightly, about 2 minutes. Pour the warm dressing over the salads and serve."
Heart Healthy Blueberry Smoothie,"1 cup blueberries, Â¾ cup pomegranate juice, Â½ cup low-fat plain Greek-style yogurt, Â½ cup skim milk, Â½ cup rolled oats, Â¼ cup granular sucralose sweetener (such as SplendaÂ®), 1 teaspoon ground cinnamon","Blend blueberries, pomegranate juice, yogurt, milk, oats, sweetener, and cinnamon together in a blender until smooth, about 2 minutes."
Homemade Grenadine,"1 cup white sugar, Â½ cup pomegranate juice","Pour sugar and pomegranate juice into a sauce pan and warm over low heat, whisking continuously until the sugar dissolves. Cool, pour into a bottle or jar, and store sealed in the refrigerator."
Spiced Pears and Pomegranate,"3  pears - peeled, cored and cut into wedges, 1  pomegranate, skin and light-colored membrane removed, 1 tablespoon fresh lemon juice, 2 tablespoons light brown sugar, Â¼ teaspoon ground nutmeg, Â½ teaspoon ground cinnamon, 2 tablespoons finely chopped almonds (Optional), 4 sprigs fresh mint leaves for garnish (Optional)","Place the sliced pears and pomegranate seeds into a bowl. Toss with lemon juice to coat. Combine the brown sugar, nutmeg, and cinnamon in a small cup or bowl, then mix into the fruit. Cover and refrigerate for at least 1 hour before serving to blend the flavors. Serve in individual dishes, and garnish with a sprinkling of chopped almonds and a sprig of mint."
Chef John's Sweet Potato Biscuits,"1 large orange-fleshed sweet potato, peeled, 1 teaspoon salt, 1 tablespoon brown sugar, Â½ cup buttermilk, 3 Â¼ cups self-rising flour, 1 Â½ sticks unsalted butter, frozen, 1 tablespoon melted butter","Cut sweet potato in half lengthwise. Cut each in half again lengthwise, then in half cross-wise. Cut each piece in half to make about 16 evenly sized chunks. Transfer into pot; cover with water and add salt. Bring to a simmer on high heat; reduce heat to medium-low and cook until potatoes are tender, about 17 minutes. Drain thoroughly; return to pot and mash potatoes. You will need 1 1/2 cups mashed sweet potatoes. Cool thoroughly.
Transfer cooled mashed potatoes to a mixing bowl. Add brown sugar and buttermilk. Mix together until well combined.
Place self-rising flour in a separate mixing bowl. Grate frozen butter into flour, tossing with a fork to coat with flour after each addition of about 1/3 to 1/2 stick. This will prevent butter from clumping. Mixture should look like floury pieces of butter. Add sweet potato mixture. Toss with a fork until evenly distributed, but don't overmix.
Transfer mixture onto a lightly floured work surface. Push and press mixture together into a rectangular shape, about 1 1/2 inches thick. Dough will be floury and a bit crumbly. Fold rectangle into thirds, lifting up one-third and folding onto the middle and doing the same with the other side. Dust with a bit of flour if sticking.
Preheat oven to 425 degrees F (220 degrees C). Line a rimmed baking sheet with a silicone mat.
Press dough into a rectangle again, about 1 inch thick. Repeat the tri-fold step. Press out into a rectangle, about 1 inch thick. Trim off the rough edges to square off the sides; this will maximize rising. Cut into 8 equal portions. Transfer to prepared baking pan, spacing biscuits evenly. Brush tops lightly with 1 tablespoon melted butter.
Bake in preheated oven until browned, 20 to 25 minutes. Cool slightly before serving.
Mix 4 tablespoons butter (room temperature), pomegranate syrup, and pomegranate juice together in a small bowl. Spread on warm biscuits. Sprinkle with a few pomegranate seeds for garnish.









"
Spinach and Persimmon Salad with Goat Cheese and Pomegranate,"1  Fuyu persimmon, peeled and cored, 2 cups roughly chopped spinach, 3 tablespoons pomegranate seeds, 2 ounces goat cheese, crumbled, 1 tablespoon sliced almonds","Slice persimmon into 1/4-inch rounds, then slice each round into quarters.
Place chopped spinach into a salad bowl. Top with persimmon quarters, pomegranate seeds, goat cheese, and sliced almonds.
Whisk together olive oil, orange juice, lemon juice, Dijon mustard, salt, and pepper in a small bowl. Drizzle vinaigrette over salad and toss lightly to coat. Serve immediately."
Pavlova with Winter Fruits,"4  egg whites, at room temperature, Â¾ cup white sugar, Â¼ cup superfine sugar, 1 Â½ teaspoons cornstarch, Â½ teaspoon orange blossom water (Optional), Â½ teaspoon white vinegar","Preheat the oven to 250 degrees F (120 degrees C). Line a large baking sheet with parchment paper. Invert a small bowl onto the parchment paper and trace the rim with a pencil. Repeat twice more. Flip parchment paper over.
Beat egg whites in a large bowl with an electric mixer until soft peaks begin to form. Gradually add white sugar, with the mixer running. Whisk superfine sugar and cornstarch in a small bowl. Gradually beat into the meringue. Continue beating meringue until stiff, glossy peaks form. Beat in orange blossom water and vinegar.
Spoon meringue into the traced circles. Make the borders higher than the center, to leave room for the filling.
Bake meringues in the preheated oven until firm and dry to the touch, about 1 hour.
Meanwhile, make the lemon curd. Fill a medium saucepan with 1 inch of water and bring to a bare simmer.
Whisk lemon juice, lemon zest, sugar, egg yolks, and salt together in a glass bowl. Set the bowl over the simmering water. Cook, whisking constantly, until curd foams, then thickens, about 10 minutes. Remove the bowl from the simmering water. Gradually whisk in coconut oil until melted and incorporated.
Strain the curd through a fine-mesh sieve; discard solids left in the strainer. Press a sheet of plastic wrap directly onto the surface to prevent a skin from forming. Transfer to the refrigerator.
Turn off oven and keep meringues inside until completely dry, about 1 hour.
Combine heavy cream, confectioners' sugar, and orange blossom water in a bowl. Beat with an electric mixer until soft peaks form.
Spoon lemon curd into the center of the cooled meringues. Mound whipped cream over the curd. Arrange grapefruit, orange, and persimmon slices on top. Sprinkle pomegranate seeds over the top."
Cranberry-Pomegranate Mimosa,"2 tablespoons white sugar, or as needed, 3  frozen cranberries, 1 fluid ounce cranberry-pomegranate juice (such as Ocean SprayÂ®), 1 fluid ounce orange juice, 2 fluid ounces champagne","Fill a small plate with 1/4 inch of water. Pour sugar onto a second small plate, making a depth of 1/8 to 1/4 inch. Gently dip the rim of a champagne glass into the water. Raise the glass to allow excess water to drip off, then dip the rim into the sugar. Twist the glass to ensure the entire rim is coated. Discard remaining sugar.
Place cranberries in the bottom of the champagne glass. Add cranberry-pomegranate juice, orange juice, and champagne."
Holiday Cranberry-Pomegranate Sauce,"1 (12 ounce) bag fresh cranberries, rinsed and sorted, 1 cup white sugar, 1 cup orange juice, 1 teaspoon orange zest, Â¼ teaspoon ground cloves, 2  cinnamon sticks, 1  pomegranate, peeled and seeds separated","Mix the cranberries, sugar, orange juice, orange zest, ground cloves, and cinnamon sticks together in a saucepan. Bring to a boil. Lower heat to medium, and simmer for 10 minutes, stirring constantly. Remove from the heat and cool.
Stir the pomegranate seeds into the cranberry mixture, and refrigerate at least 8 hours or overnight. Remove the cinnamon sticks before serving."
Pomegranate Stew with Chicken (Khoresh Fesenjan),"2 tablespoons olive oil, 1 Â½ pounds chicken legs, cut up, 1  white onion, thinly sliced, Â½ pound walnuts, toasted and finely ground in a food processor, 1 teaspoon salt, 4 cups pomegranate juice, Â½ teaspoon cardamom (Optional), 2 tablespoons sugar (Optional)","Heat olive oil in a large skillet over medium heat. Place chicken and onions in skillet, and cook 20 minutes, stirring occasionally. Mix in pureed walnuts, salt, pomegranate juice, and cardamom. Bring to a boil. Reduce heat to low, cover, and simmer for 1 1/2 hours, stirring occasionally. (If the sauce becomes too thick, stir in 1/4 cup warm water.) Mix in sugar, adjust seasoning, and simmer 30 minutes more."
Cranberry Pomegranate Sauce,"2 large tart apples, 2  pomegranates, peeled and seeds separated, 1 (16 fl oz) bottle pomegranate juice, 2 cups white sugar, 2 large  oranges, 2 (12 ounce) bags fresh cranberries, rinsed and sorted, 1 cup pecans, chopped","Peel and core apples, and put peelings and cores in a small saucepan with pomegranate seeds, 1/2 cup juice, and 1/2 cup sugar. Bring to a boil, and then reduce heat to simmer. Cook for 30 minutes.
Chop the peeled apples, and place in a large saucepan. Remove zest from half of one orange, chop very fine, and add to apples. Peel oranges, chop coarsely, and add to pan along with cranberries and remaining juice and sugar. Bring to a boil, reduce heat to simmer, and cook for 30 minutes.
Remove small pan from heat, and strain juice into larger pan. Cool solids slightly, and then push though a sieve to remove seeds and peels, adding remaining pulp to larger pan. Stir in nuts, if desired. Cook about 10 minutes longer. Serve warm, room temperature, or chilled."
Smokey Butternut Squash Soup,"1  butternut squash - peeled and cut into cubes, seeds removed and reserved, Â½  shallot, diced, 3 tablespoons canola oil, divided , 2 teaspoons smoked paprika, 1 Â½ teaspoons chili powder, 1 Â½ teaspoons chipotle chile powder, 1 teaspoon minced fresh ginger,   salt and ground black pepper to taste, 6  fresh Brussels sprouts, cored and separated into leaves, 2 tablespoons maple syrup, 1 Â½ cups almond milk, Â¼ cup crumbled goat cheese, or to taste,   seeds of 1 pomegranate","Preheat oven to 375 degrees F (190 degrees C). Line a roasting pan with a large sheet of aluminum foil.
Toss butternut squash, shallot, 2 tablespoons canola oil, paprika, chili powder, chipotle powder, and ginger together in a bowl until evenly mixed and coated. Pour into prepared roasting pan and wrap aluminum foil around squash mixture.
Bake in the preheated oven until squash is tender, 30 to 40 minutes.
Heat 1 tablespoon canola oil in a cast-iron skillet over medium heat. Cook and stir reserved butternut squash seeds, pinch salt, and pinch ground black pepper in the skillet until lightly toasted, 5 minutes. Add Brussels sprouts leaves and cook, stirring occasionally, until leaves are slightly crispy and seeds are browned, 10 to 15 minutes. Stir maple syrup into seed mixture and immediately remove from heat.
Pour butternut squash mixture and almond milk into a blender no more than half full. Cover and hold lid down; pulse a few times before leaving on to blend. Puree in batches until soup is smooth.
Pour butternut squash soup into bowls and top with squash seeds and Brussels sprouts mixture, pomegranate seeds, and goat cheese."
Pomegranate Grenadine,"4 cups pomegranate juice, divided, 1 cup white sugar",Combine 3 cups pomegranate juice and sugar together in a saucepan; heat to 244 degrees F (118 degrees C) or until a small amount of mixture dropped into cold water forms a firm ball. Remove saucepan from heat and cover with a lid; let cool until pan is cool enough to touch. Stir remaining 1 cup pomegranate juice into mixture. Refrigerate.
Halloumi Three-Bean Salad with Pomegranate-Harissa Vinaigrette,"7 ounces halloumi cheese, cut into 1-inch slabs, 2 tablespoons pomegranate vinegar, 1 tablespoon honey, 1 Â½ teaspoons harissa, or more to taste, 3 tablespoons olive oil, 1 pinch freshly ground black pepper, 1 cup black beans, drained and rinsed, 1 cup kidney beans, drained and rinsed, 1 cup white beans, drained and rinsed, â…?cup chopped red onion, 2 tablespoons chopped fresh mint, 2 tablespoons chopped fresh cilantro","Heat a large nonstick pan over medium-high heat. Cook each halloumi slab on all 4 sides, about 5 minutes. Set aside and allow to cool slightly; cut into 1/4-inch cubes.
While cheese is cooking, whisk pomegranate vinegar, honey, harissa, olive oil, and black pepper together in a dressing jar. Set aside.
Combine black beans, kidney beans, white beans, onion, mint, and cilantro in a bowl and toss with a spoon. Add cooked halloumi. Drizzle vinaigrette dressing over salad and toss to coat. Cover and allow to sit at room temperature at least 15 minutes."
Salmon with Pomegranate Glaze,"â…?cup pomegranate juice, 1 tablespoon soy sauce, or to taste, 1 clove garlic, sliced, 4 (6 ounce) fillets salmon, 2 tablespoons olive oil, Â½  pomegranate, peeled and seeds separated","Whisk pomegranate juice, soy sauce, and garlic together in a shallow non-reactive bowl until marinade is well mixed. Add salmon and turn to coat. Cover and marinate for 15 minutes.
Heat olive oil in a skillet over medium heat; add garlic from the marinade and cook until lightly browned, 1 to 2 minutes. Pour in the marinade and cook until reduced and thickened to a glaze, 4 to 5 minutes.
Preheat an outdoor grill for medium-high heat and lightly oil the grate.
Cook salmon on the preheated grill until flesh flakes easily with a fork, about 3 minutes per side. Serve salmon topped with glaze and garnished with pomegranate seeds."
"Apple, Pomegranate, and Pecan Salad","Â½ cup pomegranate juice, 1 tablespoon balsamic vinegar, 1 teaspoon Dijon mustard, 1 teaspoon honey, Â¼ cup canola oil, â…?teaspoon salt, â…?teaspoon ground black pepper, 2 medium Granny Smith apples, cored and chopped, 1 (5 ounce) package baby spinach, â…?cup pomegranate seeds, â…?cup candied pecans, Â¼ cup crumbled feta cheese","Combine pomegranate juice, balsamic vinegar, Dijon, and honey in the bowl of a food processor; pulse until combined. Keep the blade running and slowly pour canola oil in through the food chute until smooth. Add salt and pepper and set dressing aside.
Toss apples, spinach, pomegranate seeds, pecans, and feta cheese together in a large bowl. Drizzle dressing on top and toss until well combined."
Creamy Pomegranate Ice Cream,"1 cup heavy cream, 1 cup white sugar, 1 cup pomegranate juice, 1 teaspoon vanilla extract, 1 pinch salt","Stir together the heavy cream and sugar. Stir in the pomegranate juice, vanilla extract, and salt. Add the mixture to an ice cream maker and freeze according to the manufacturer's directions."
Spiced Pomegranate Syrup,"Â¾ cup pomegranate juice, Â¾ cup Shiraz or other dry red wine, 2 tablespoons fresh lemon juice, 1 Â½ teaspoons ground cinnamon, Â¼ teaspoon ground nutmeg, â…?teaspoon ground cloves, â…?teaspoon ground ginger, 1 tablespoon butter, Â½ cup packed brown sugar, divided","Combine the pomegranate juice, wine, and lemon juice in a bowl. Whisk in the cinnamon, nutmeg, cloves and ginger. Crumble in half of the brown sugar and whisk mixture until sugar dissolves.
Melt the butter in a skillet over medium heat and swirl to coat the pan. Immediately pour in the juice/spice mixture and increase the heat to high. Bring mixture to a boil while whisking to prevent scorching. Reduce heat to medium and, while stirring, add the remaining brown sugar a little at a time. Cook and stir until mixture thickens to a syrupy consistency or when it can coat the back of a spoon.
Remove from heat and allow to cool slightly and continue to cool, 5 to 10 minutes. Stir and serve."
Roasted Pork Shoulder with Pomegranate Sauce,"1 (3 pound) bone-in pork shoulder roast, 2 teaspoons minced garlic,   kosher salt and ground black pepper to taste, 2  pomegranates with the seeds removed, Â½ cup water, 2 tablespoons balsamic vinegar, 2 tablespoons turbinado sugar, Â¼ teaspoon ground cinnamon","Preheat the oven to 325 degrees F (165 degrees C). Season the pork roast with garlic, kosher salt, and pepper. Place in a roasting pan.
Bake the roast for 1 hour in the preheated oven. While the roast is baking, combine the pomegranate seeds and water in a large saucepan. Bring to a boil, then reduce the heat to low and simmer for 20 to 30 minutes, until the pomegranate seeds have broken down and released their juices. Press through a strainer to get as much juice as possible. You should have about 3/4 cup of juice.
Pour the juice from the pomegranate into a saucepan and bring to a boil. Simmer over medium heat until reduced by half. Remove from the heat and mix in the balsamic vinegar, sugar, and cinnamon.
After the roast has been in the oven for 45 minutes, baste it with pomegranate sauce, using a brush to apply it to the top and sides. Continue to roast the pork, basting every 10 minutes, until the internal temperature has reached 180 degrees F (80 degrees C), about 30 minutes. Remove from the oven, tent with foil, and allow to rest for 20 minutes before carving and serving."
Holiday Pomegranate Mignonette,"3 tablespoons champagne vinegar, 1 tablespoon pomegranate juice, Â½  shallot, minced, Â½ teaspoon fresh cracked pepper, 1 pinch white sugar, 1 tablespoon pomegranate seeds","Whisk vinegar, pomegranate juice, shallot, pepper, and white sugar together in a bowl until sugar dissolves. Add pomegranate seeds, cover the bowl with plastic wrap, and refrigerate until chilled, about 1 hour."
Freekeh Salad with Tahini Dressing,"1 cup freekeh, 2 cups chicken broth, 3 tablespoons apple cider vinegar, 1 tablespoon tahini, 1 teaspoon honey, 2 tablespoons olive oil,   salt and ground black pepper to taste, Â½ cup pomegranate seeds, Â¼ cup red onion, minced, 2 tablespoons minced fresh mint, 2 tablespoons minced fresh parsley, Â½ cup crushed pistachios","Stir freekeh in a medium-sized saucepan over medium-high heat until lightly toasted and fragrant, about 3 minutes. Add broth and bring to a simmer. Cover pan and cook until water is absorbed, about 20 minutes. Remove from heat and let stand 5 minutes. Transfer freekeh to a bowl to cool.
Meanwhile, whisk vinegar, tahini, and honey together in a small bowl. Slowly drizzle in olive oil and whisk until combined. Season with salt and pepper.
Add pomegranate seeds, onion, mint, and parsley to the bowl with the cooked freekeh. Drizzle in the dressing and toss to coat. Season with additional salt and pepper, if desired. Refrigerate 30 minutes. Top with pistachios right before serving so they don't soften."
Pretty Pomegranate Salad,"10 ounces fresh baby spinach leaves, 10 ounces arugula leaves, Â½  red onion, thinly sliced, 1 (10 ounce) can mandarin oranges, drained, 1  pomegranate, peeled and seeds separated","Place the spinach and arugula leaves into a mixing bowl. Add the onion, mandarin oranges, and pomegranate seeds. Toss gently by hand to mix."
Pomegranate Relish,"2  pomegranates, 3 tablespoons olive oil, 1  shallot, minced, 1 tablespoon lime juice,   salt and pepper to taste, Â½ cup fresh cilantro, chopped","Juice the pomegranates retaining the seeds and juice.
Heat oil in a small skillet over medium heat. Saute shallots until golden. Stir in pomegranate juice and seeds, lime juice, salt and pepper. Cook for about 3 minutes, or until slightly reduced. Remove from heat and stir in cilantro.
Serve at room temperature."
Khoresht Fesenjaan (Chicken with Pomegranate Sauce),"Â½ cup vegetable oil, 4 medium red onions, thinly sliced, 3 pounds bone-in chicken pieces, 2 cups hot water or as needed, 2 Â½ cups pomegranate juice, 4 cups chopped walnuts, 2 tablespoons freshly ground cardamom, 2 tablespoons ground cinnamon, 1 medium butternut squash, seeded and cubed, Â¼ teaspoon saffron powder, 1 teaspoon salt, or to taste","Heat the oil in a large heavy skillet over medium heat. Stir in sliced onions; cook and stir until the onion has softened and turned translucent, about 5 minutes. Reduce heat to medium-low, and continue cooking and stirring until the onion is very tender and dark brown, 15 to 20 minutes more.
Raise heat to medium-high. Add chicken pieces, and fry until lightly browned on the outside. Pour in the water, and bring to a boil. Reduce heat to low and simmer for about 30 minutes, adding more water if necessary to keep the mixture from drying out.
Preheat the oven to 325 degrees F (65 degrees C).
Combine the walnuts and pomegranate juice in the container of a blender or food processor. Process into liquid. (This can be done in small batches if necessary.) Add walnut-pomegranate mixture to the simmering chicken. Season with cardamom, cinnamon, saffron powder, and salt. Stir in the cubed squash. Transfer the entire mixture to a 9x13-inch baking dish.
Bake, loosely covered, for 2 1/2 hours in the preheated oven. Serve with white rice."
"Persimmon, Pomegranate, and Massaged Kale Salad","Â½ cup raw macadamia nuts, 2 tablespoons maple syrup, divided, 1 pinch salt","Preheat oven to 375 degrees F (190 degrees C). Line a baking sheet with parchment paper.
Toss macademia nuts with 1 tablespoon maple syrup and pinch of salt; spread on baking sheet.
Toast macademia nuts in the preheated oven until lightly golden, about 5 minutes. Remove from oven and coat with 1 tablespoon maple syrup.
Whisk orange juice, lemon juice, 1 tablespoon maple syrup, and ground black pepper together in a small bowl to make dressing.
Place kale pieces, 1 tablespoon olive oil, and 1/2 teaspoon salt in a large bowl; massage with your hands until kale is tender, 3 to 5 minutes. Add persimmon slices and dressing and toss to mix. Top with pomegranate seeds and maple-roasted macademia nuts."
