recipe_name,ingredients,directions
Mexican Pizza I,"1 (16 ounce) can refried beans, 1 pound ground beef, 1 (1.25 ounce) package taco seasoning mix, 1 tablespoon vegetable oil, 4 (6 inch) corn tortillas, 8 ounces shredded Cheddar cheese, 8 tablespoons sour cream, 2  roma (plum) tomatoes, chopped, 2  green onion, chopped, 1 (4 ounce) can diced green chiles, drained, Â½  avocado, diced, 1 tablespoon black olives, sliced","Heat the refried beans.
In a large skillet, brown the ground beef. Stir in the seasoning packet.
Preheat oven to 350 degrees F (175 degrees C).
Place a small amount of vegetable oil in a large skillet. Let the oil heat, then place one corn tortilla in the skillet. After 15 seconds, flip the tortilla over and let it fry another 15 seconds. Repeat this process with the remaining tortillas, letting them drain on paper towels once they have been heated. When the tortillas have drained, arrange them on a cookie sheet.
Spread a thin layer of beans on the tortillas, followed by a layer of beef, and cheese.
Bake the tortillas in the preheated oven for 20 to 30 minutes. Slice the tortillas into wedges and arrange them on plates or a serving platter and garnish them with the sour cream, tomatoes, green onions, chiles, avocado, and olives.











Unknown
"
Carne Asada Tacos,"1 Â½ pounds boneless beef top sirloin, cut into thin bite-size slices, Â½ teaspoon salt, 1 teaspoon freshly ground black pepper,   crushed red pepper to taste, 1  lime, 1 (28 ounce) can tomatillos, 2  fresh jalapeno peppers, seeded, 4 tablespoons canola oil, divided, 1 (10.5 ounce) can beef broth, 12 (6 inch) corn tortillas, Â½ large onion, chopped, 2  tomatoes, chopped, 1  avocado - peeled, pitted and sliced, 1 bunch fresh cilantro, chopped, 1  lemon","Place sliced meat into a shallow bowl, and season with salt, black pepper, and crushed red pepper. Squeeze the lime juice over the meat, and turn until evenly coated. Cover, and refrigerate for 30 minutes.
In a blender or food processor, combine tomatillo and jalapeno. Puree for 15 to 20 seconds, or until thick. Heat 1 tablespoon oil in a large skillet over medium high heat. Carefully pour in tomatillo mixture. Cook, stirring frequently, for 5 minutes. Stir in beef broth. Reduce heat, and simmer for 20 to 30 minutes, or until mixture coats a spoon. Transfer mixture to a serving dish.
Heat tablespoon oil in a large skillet over high heat. Stir in 1/3 of the beef, and saute for 1 minute. Transfer to serving dish. Repeat with remaining beef. Meanwhile, heat tortillas in the oven or microwave, according to package instructions.
To serve, place two tortillas on top of each other. Add desired amount of meat, spoon over some tomatillo mixture. Top with onions, tomatoes, avocado and cilantro. Garnish with a wedge of lemon, to be squeezed over taco before eating."
Smoked Salmon Sushi Roll,"2 cups Japanese sushi rice, 6 tablespoons rice wine vinegar, 6 sheets nori (dry seaweed), 1  avocado - peeled, pitted and sliced, 1  cucumber, peeled and sliced, 8 ounces smoked salmon, cut into long strips, 2 tablespoons wasabi paste","Soak rice for 4 hours. Drain rice and cook in a rice cooker with 2 cups of water. Rice must be slightly dry as vinegar will be added later.
Immediately after rice is cooked, mix in 6 tablespoons rice vinegar to the hot rice. Spread rice on a plate until completely cool.
Place 1 sheet of seaweed on bamboo mat, press a thin layer of cool rice on the seaweed. Leave at least 1/2 inch top and bottom edge of the seaweed uncovered. This is for easier sealing later. Dot some wasabi on the rice. Arrange cucumber, avocado and smoked salmon to the rice. Position them about 1 inch away from the bottom edge of the seaweed.
Slightly wet the top edge of the seaweed. Roll from bottom to the top edge with the help of the bamboo mat tightly. Cut roll into 8 equal pieces and serve. Repeat for other rolls."
Avocado Deviled Eggs,"6  hard-boiled eggs, peeled and halved, 1  avocado - peeled, pitted, and diced, 3 slices cooked turkey bacon, chopped, divided, 2 Â½ tablespoons mayonnaise, 2 teaspoons lime juice, 1 clove garlic, crushed, â…?teaspoon cayenne pepper,   sea salt to taste, 1  jalapeno pepper, sliced (Optional), 1 dash hot sauce, or to taste (Optional)","Scoop egg yolks into a bowl; add avocado, 2/3 of chopped turkey bacon, mayonnaise, lime juice, garlic, cayenne pepper, and salt. Mash egg yolk mixture until filling is evenly combined.
Spoon filling into a piping bag or plastic bag with a snipped corner. Pipe filling into each egg white; top with a turkey bacon piece, jalapeno slice, and dash hot sauce."
Mexican Chicken and Rice Soup (Sopa de Pollo y Arroz),"2 Â½ quarts chicken stock, 2 pounds skin-on, bone-in whole chicken legs (drumsticks and thighs), 3  carrots, chopped, 1  white onion, chopped, 2 stalks celery, chopped, Â¼ cup chopped fresh cilantro, 1 clove garlic, 1 tablespoon chopped fresh mint,   salt and ground black pepper to taste, 3 cups cooked rice, 1  avocado, peeled and chopped, 2  serrano peppers, minced, 2  limes, quartered","Bring stock to a boil in a large pot over high heat. Add chicken legs; return to a boil. Reduce heat, cover, and simmer for 10 minutes, skimming away foam that forms on the surface. Add carrots, onion, celery, cilantro, garlic, and mint.
Cover pot and cook until chicken is no longer pink at the bone and the juices run clear, about 30 minutes more. Remove chicken from the pot; discard skin and bones. Shred meat using 2 forks.
Return chicken meat to the pot and season with salt and pepper. Add rice. Let chicken and rice warm up, about 5 minutes. Remove from heat and pour soup into serving bowls. Top with avocado and serrano peppers and squeeze in lime juice."
Easy Arugula Salad,"4 cups young arugula leaves, rinsed and dried, 1 cup cherry tomatoes, halved, Â¼ cup pine nuts, 2 tablespoons grapeseed oil or olive oil, 1 tablespoon rice vinegar,   salt to taste,   freshly ground black pepper to taste, Â¼ cup grated Parmesan cheese, 1 large avocado - peeled, pitted and sliced","In a large plastic bowl with a lid, combine arugula, cherry tomatoes, pine nuts, oil, vinegar, and Parmesan cheese. Season with salt and pepper to taste. Cover, and shake to mix.
Divide salad onto plates, and top with slices of avocado."
California Roll Sushi,"1 cup uncooked short-grain white rice, 1 cup water, Â¼ cup rice vinegar, 1 tablespoon white sugar, Â½ cup imitation crabmeat, finely chopped, Â¼ cup mayonnaise, 8 sheets nori (dry seaweed), 2 Â½ tablespoons sesame seeds, 1  cucumber, cut into thin spears, 2  avocados - pitted, peeled, and sliced the long way","Wash the rice in several changes of water until the rinse water is no longer cloudy, drain well, and place in a covered pan or rice cooker with 1 cup water. Bring to a boil, reduce heat to a simmer, and cover the pan. Allow the rice to simmer until the top looks dry, about 15 minutes. Turn off the heat, and let stand for 10 minutes to absorb the rest of the water.
Mix the rice vinegar and sugar in a small bowl until the sugar has dissolved, and stir the mixture into the cooked rice until well combined. Allow the rice to cool, and set aside.
Mix the imitation crabmeat with mayonnaise in a bowl, and set aside. To roll the sushi, cover a bamboo rolling mat with plastic wrap. Lay a sheet of nori, shiny side down, on the plastic wrap. With wet fingers, firmly pat a thin, even layer of prepared rice over the nori, leaving 1/4 inch uncovered at the bottom edge of the sheet. Sprinkle the rice with about 1/2 teaspoon of sesame seeds, and gently press them into the rice. Carefully flip the nori sheet over so the seaweed side is up.
Place 2 or 3 long cucumber spears, 2 or 3 slices of avocado, and about 1 tablespoon of imitation crab mixture in a line across the nori sheet, about 1/4 from the uncovered edge. Pick up the edge of the bamboo rolling sheet, fold the bottom edge of the sheet up, enclosing the filling, and tightly roll the sushi into a cylinder about 1 1/2 inch in diameter. Once the sushi is rolled, wrap it in the mat and gently squeeze to compact it tightly.
Cut each roll into 1 inch pieces with a very sharp knife dipped in water."
Avocado Shrimp Ceviche-Estillo Sarita,"2 pounds large shrimp - peeled, deveined and chopped, Â¾ cup fresh lime juice, 5  roma (plum) tomatoes, diced, 1  white onion, chopped, Â½ cup chopped fresh cilantro, 1 tablespoon Worcestershire sauce, 1 tablespoon ketchup, 1 teaspoon hot pepper sauce,   salt and pepper to taste, 1  avocado - peeled, pitted and diced, 16  saltine crackers","Place the shrimp and lime juice into a large bowl, and stir to coat. Let stand for about 5 minutes, or until shrimp are opaque. The lime juice will cook them. Mix in the tomatoes, onion, and cilantro until coated with lime juice; cover and refrigerate for 1 hour.
Remove from the refrigerator, and mix in the Worcestershire sauce, ketchup, hot sauce, salt and pepper. We have our own hot sauce recipe, but you can use whatever hot sauce you like, or leave it out and let people add their own when serving.
Serve in glass tumblers and top with avocado pieces. Set out extra Worcestershire sauce, ketchup, lime wedges and hot sauce for people to individualize their dish. Serve with saltine crackers.









"
Avocado Toast (Vegan),"4 slices whole-grain bread, 1  avocado, halved and pitted, 2 tablespoons chopped fresh parsley, 1 Â½ teaspoons extra-virgin olive oil, Â½  lemon, juiced, Â½ teaspoon salt, Â½ teaspoon ground black pepper, Â½ teaspoon onion powder, Â½ teaspoon garlic powder","Toast bread in a toaster or toaster oven.
Scoop avocado into a bowl. Add parsley, olive oil, lemon juice, salt, pepper, onion powder, and garlic powder; mash together using a potato masher. Spread avocado mixture into each piece of toast."
Quesadillas I,"10 (6 inch) corn tortillas, 2 cups shredded mozzarella cheese, 1 (2 ounce) can sliced black olives, 2  avocados - peeled, pitted and sliced, 2 teaspoons hot pepper sauce","Heat a large frying pan or griddle over a medium heat. Place one tortilla flat on the frying pan. After 1 minute flip the tortilla over. Sprinkle a little more than 1/4 cup cheese on the tortilla, followed by some olives, avocado, and hot pepper sauce. Place another tortilla on top to make a sandwich. Cover the quesadilla with a lid. After one minute, flip the quesadilla. When the cheese has melted on the inside, remove the quesadilla. Repeat with remaining ingredients.
Cut the quesadillas into triangles and serve."
Avocado Toast with Egg,"1 teaspoon butter, 2  eggs, 2 slices multigrain bread, 1  ripe avocado, pitted, peeled, 1 teaspoon lemon juice, or to taste, 1 pinch cayenne pepper,   sea salt to taste,   ground black pepper to taste","Melt butter in a skillet over medium-low heat. Crack eggs into the skillet side by side and cook until eggs are white on the bottom layer and firm enough to flip, 2 to 3 minutes. Flip eggs, trying not to crack the yolk, and cook until egg reaches desired doneness, 2 to 5 minutes more.
Meanwhile, toast bread slices to desired doneness, 3 to 5 minutes.
Mash avocado in a bowl; stir in lemon juice, cayenne pepper, and sea salt. Spread avocado mixture onto toast. Top with fried egg and season with sea salt and pepper."
"Kale, Quinoa, and Avocado Salad with Lemon Dijon Vinaigrette","â…?cup quinoa, 1 â…?cups water, 1 bunch kale, torn into bite-sized pieces, Â½  avocado - peeled, pitted, and diced, Â½ cup chopped cucumber, â…?cup chopped red bell pepper, 2 tablespoons chopped red onion, 1 tablespoon crumbled feta cheese","Bring the quinoa and 1 1/3 cup water to a boil in a saucepan. Reduce heat to medium-low, cover, and simmer until the quinoa is tender, and the water has been absorbed, about 15 to 20 minutes. Set aside to cool.
Place kale in a steamer basket over 1 inch of boiling water in a saucepan. Cover saucepan with a lid and steam kale until hot, about 45 seconds; transfer to a large plate. Top kale with quinoa, avocado, cucumber, bell pepper, red onion, and feta cheese.
Whisk olive oil, lemon juice, Dijon mustard, sea salt, and black pepper together in a bowl until the oil emulsifies into the dressing; pour over the salad.











Grace Magyar
"
Awesome Turkey Sandwich,"2 slices whole wheat bread, toasted (Optional), 1 tablespoon mayonnaise, 2 teaspoons Dijon-style prepared mustard, 3 slices smoked turkey breast, 2 tablespoons guacamole, Â½ cup mixed salad greens, Â¼ cup bean sprouts, Â¼  avocado - peeled, pitted and sliced, 3 ounces Colby-Monterey Jack cheese, sliced, 2 slices tomato","Spread mayonnaise on one slice of toast, then spread mustard on the other. Arrange the sliced turkey on one side. Spread guacamole over the turkey. Pile on the salad greens, bean sprouts, avocado and cheese. Finish with tomato slices, then place the remaining slice of toast on top."
Grilled Avocados,"Â¼ cup olive oil, or as needed, 1 pinch ground chipotle pepper, or more to taste, 1 pinch chili powder, or more to taste , 4  avocados, halved and pitted","Preheat grill for medium heat and lightly oil the grate.
Whisk olive oil, ground chipotle pepper, and chili powder together in a bowl; brush over the entire surface of the cut-side of each avocado.
Grill avocados, cut-side down, on the preheated grill until grill-lines begin to form on the avocado flesh, about 5 minutes."
Taco Salad III,"16 ounces lean ground beef, 1 (1.25 ounce) package taco seasoning mix, 1 head iceberg lettuce, shredded, 1  red onion, sliced, 1 bunch green onions, chopped, 1 (15 ounce) can pinto beans, drained, 1 (15 ounce) can kidney beans, drained, 2 large tomatoes, chopped, 1  avocados - peeled, pitted, and cubed, 8 ounces shredded Cheddar cheese, 1 (16 ounce) package corn chips, 1 (16 ounce) bottle Catalina salad dressing","Prepare the ground beef as directed by taco seasoning package and set aside.
In a large bowl, combine the beef mixture, lettuce, red onion, green onion, pinto beans, kidney beans, tomatoes, avocado and cheese. Mix well.
Before serving, add the corn chips and enough dressing to coat. Mix well and serve immediately."
Vegetarian Tortilla Soup,"2 tablespoons vegetable oil, 1 (1 pound) package frozen pepper and onion stir fry mix, 2 cloves garlic, minced, 3 tablespoons ground cumin, 1 (28 ounce) can crushed tomatoes, 3 (4 ounce) cans chopped green chile peppers, drained, 4 (14 ounce) cans vegetable broth,   salt and pepper to taste, 1 (11 ounce) can whole kernel corn, 12 ounces tortilla chips, 1 cup shredded Cheddar cheese, 1  avocado - peeled, pitted and diced","Heat the oil in a large pot over medium heat. Stir in the pepper and onion stir fry mix, garlic, and cumin, and cook 5 minutes, until vegetables are tender. Mix in the tomatoes and chile peppers. Pour in the broth, and season with salt and pepper. Bring to a boil, reduce heat to low, and simmer 30 minutes.
Mix corn into the soup, and continue cooking 5 minutes. Serve in bowls over equal amounts of tortilla chips. Top with cheese and avocado."
Easy Keto Beef Tacos,"2 cups shredded Cheddar cheese, 1 pound ground beef, Â½ package taco seasoning mix, Â½ teaspoon salt, Â¼ teaspoon ground black pepper, 1  avocado, diced, 1 cup shredded lettuce, Â½ cup shredded Cheddar cheese, Â½ cup tomatoes, diced","Preheat oven to 350 degrees F (175 degrees C). Line 2 baking sheets with parchment paper or silicone mat.
Spread Cheddar cheese into four 6-inch circles, placed 2 inches apart.
Bake in the preheated oven until cheese melts and is lightly brown, 6 to 8 minutes.
Cool for 2 to 3 minutes before lifting with a spatula. Place over wooden spoon handle wrapped in aluminum foil balanced over 2 cups/cans. Let taco shells cool completely, about 10 minutes.
Cook beef in a skillet over medium-high heat until browned, stirring often to separate meat, about 7 minutes. Season with taco seasoning, salt, and pepper; cook for 1 minute more.
Divide beef mixture among cheese taco shells. Top with avocado, lettuce, Cheddar cheese, and tomatoes.









"
Turkey Avocado Panini,"Â½  ripe avocado, Â¼ cup mayonnaise, 2  ciabatta rolls, 1 tablespoon olive oil, divided, 2 slices provolone cheese, 1 cup whole fresh spinach leaves, divided, Â¼ pound thinly sliced mesquite smoked turkey breast, 2  roasted red peppers, sliced into strips","Mash the avocado and the mayonnaise together in a bowl until thoroughly mixed.
Preheat a panini sandwich press.
To make the sandwiches, split the ciabatta rolls in half the flat way, and brush the bottom of each roll with olive oil. Place the bottoms of the rolls onto the panini press, olive oil side down. Place a provolone cheese slice, half the spinach leaves, half the sliced turkey breast, and a sliced roasted red pepper on each sandwich. Spread half of the avocado mixture on the cut surface of each top, and place the top of the roll on the sandwich. Brush the top of the roll with olive oil.
Close the panini press and cook until the bun is toasted and crisp, with golden brown grill marks, and the cheese has melted, about 5 to 8 minutes."
Corn and Avocado Salsa,"3 ears fresh corn, husks and silks removed, 2  avocados - peeled, pitted, and cubed, 1  red onion, finely diced, 1  red bell pepper, seeded and diced, 1 tablespoon minced garlic, 1 tablespoon ground cumin, 1 teaspoon crushed red pepper flakes, Â¼ cup chopped fresh cilantro, â…?cup red wine vinegar, 2 tablespoons olive oil, Â¼ cup fresh lime juice,   salt and black pepper to taste","Place the corn in a large pot with enough water to cover, and bring to a boil. Cook until kernels are tender but crisp, about 5 minutes. Drain, and cool in cold water. Use a knife to scrape kernels from the cobs.
Place kernels in a medium bowl. Stir in avocados, red onion, bell pepper, and garlic. Add cumin, red pepper flakes, and cilantro. Mix in vinegar, olive oil, and lime juice. Season with salt and pepper."
Harvest Salad,"Â½ cup chopped walnuts, 1 bunch spinach, rinsed and torn into bite-size pieces, Â½ cup dried cranberries, Â½ cup crumbled blue cheese, 2  tomatoes, chopped, 1  avocado - peeled, pitted and diced, Â½  red onion, thinly sliced, 2 tablespoons red raspberry jam (with seeds), 2 tablespoons red wine vinegar, â…?cup walnut oil,   freshly ground black pepper to taste,   salt to taste","Preheat oven to 375 degrees F (190 degrees C). Arrange walnuts in a single layer on a baking sheet. Toast in oven for 5 minutes, or until nuts begin to brown.
In a large bowl, toss together the spinach, walnuts, cranberries, blue cheese, tomatoes, avocado, and red onion.
In a small bowl, whisk together jam, vinegar, walnut oil, pepper, and salt. Pour over the salad just before serving, and toss to coat.









"
Warm Shrimp Salad,"1 pound medium shrimp - peeled and deveined, 2 tablespoons butter, 2  lemons, juiced, 2 heads butter lettuce, 2  tomatoes, chopped, 1  avocado - peeled, pitted and diced, 2 stalks celery, chopped, 1  cucumber, cleaned and chopped, Â½ cup shredded carrots, â…?cup vinaigrette salad dressing","In a large saute pan melt butter over medium heat. Add the shrimp and lemon juice, cook until shrimp just turn pink. Remove from heat and drain.
In a large bowl tear lettuce into bite-size pieces, add the tomatoes, avocado, celery, cucumber carrots and cooked shrimp, toss to combine. Top with your favorite dressing or vinaigrette."
Avocado Soup with Chicken and Lime,"4 (6 inch) corn tortillas, julienned, 1 Â½ tablespoons olive oil, 1  white onion, sliced thinly, 8 cloves garlic, thinly sliced, 4  fresh jalapeno peppers, sliced, 8 ounces skinless, boneless chicken breast halves - cut into thin strips, 1 quart chicken broth, Â¼ cup fresh lime juice, 1  tomato, seeded and diced,   salt and ground black pepper to taste, 1  avocado - peeled, pitted and diced, Â¼ cup chopped fresh cilantro","Preheat oven to 400 degrees F (200 degrees C). Arrange tortilla strips on a baking sheet.
Bake in the preheated oven until lightly browned, 3 to 5 minutes.
Heat oil in a large saucepan over medium heat. Cook onion, garlic, and jalapenos in oil until lightly browned, 4 to 5 minutes. Stir in chicken, chicken broth, lime juice, tomato, salt and pepper. Gently simmer until chicken is no longer pink, about 10 minutes. Stir in avocado and cilantro and heat through, 3 to 5 minutes. Adjust seasonings to taste.
Ladle soup into bowls and sprinkle with tortilla strips to serve."
Meyer Lemon Avocado Toast,"2 slices whole grain bread, Â½  avocado, 2 tablespoons chopped fresh cilantro, or more to taste, 1 teaspoon Meyer lemon juice, or to taste, Â¼ teaspoon Meyer lemon zest, 1 pinch cayenne pepper, 1 pinch fine sea salt, Â¼ teaspoon chia seeds","Toast bread slices to desired doneness, 3 to 5 minutes.
Mash avocado in a bowl; stir in cilantro, Meyer lemon juice, Meyer lemon zest, cayenne pepper, and sea salt. Spread avocado mixture onto toast and top with chia seeds."
Mexican Baked Fish,"1 Â½ pounds cod, 1 cup salsa, 1 cup shredded sharp Cheddar cheese, Â½ cup coarsely crushed corn chips, 1  avocado - peeled, pitted and sliced, Â¼ cup sour cream","Preheat oven to 400 degrees F (200 degrees C). Lightly grease one 8x12 inch baking dish.
Rinse fish fillets under cold water, and pat dry with paper towels. Lay fillets side by side in the prepared baking dish. Pour the salsa over the top, and sprinkle evenly with the shredded cheese. Top with the crushed corn chips.
Bake, uncovered, in the preheated oven for 15 minutes, or until fish is opaque and flakes with a fork. Serve topped with sliced avocado and sour cream."
Easy Never Forgotten Guacamole,"3  avocados - peeled, pitted and diced, 1 tablespoon sour cream, 2 (3 ounce) packages cream cheese, softened, 2 tablespoons salsa, 1 pinch salt, 1 dash ground black pepper, 1 dash garlic salt, 1 dash onion powder","In a small bowl, mix together the avocados, sour cream, cream cheese and salsa. Blend to desired consistency.
In a small bowl mix the salt, pepper, garlic salt and onion powder. Stir into the avocado mixture. Cover and chill in the refrigerator 1/2 hour before serving."
Avocado Dressing,"1  avocado, peeled and pitted, Â½ cup plain yogurt, Â¼ cup extra-virgin olive oil, 3 tablespoons lemon juice, 2 cloves garlic, 1 teaspoon sea salt, Â¼ teaspoon hot pepper sauce, â…?teaspoon ground black pepper","Blend avocado, yogurt, olive oil, lemon juice, garlic, sea salt, hot sauce, and black pepper together in a blender until smooth."
Avocado Egg Salad,"6  hard-boiled eggs, peeled, 2  avocados - peeled, pitted, and cubed, Â½ cup minced red onion, 3 tablespoons chopped sweet pickles, 1 tablespoon prepared yellow mustard, â…?cup mayonnaise,   salt and pepper to taste","Mash the eggs with a fork in a mixing bowl to break up. Add the avocado, onion, pickle, mustard, and mayonnaise. Gently smash the ingredients together until blended. Season to taste with salt and pepper."
Absolutely Amazing Ahi,"Â¾ pound sashimi grade tuna steak, diced, Â½ cup diced cucumber, 1  avocados - peeled, pitted and diced, Â¼ cup chopped green onion, 1 Â½ teaspoons red pepper flakes, 1 tablespoon toasted sesame seeds, 1 Â½ teaspoons lemon juice, 2 teaspoons sesame oil, Â½ cup soy sauce","In a medium bowl, combine the tuna, cucumber, avocado, green onion, red pepper flakes and sesame seeds. Pour in the lemon juice, sesame oil and soy sauce, and stir carefully to blend so as not to mash the avocado. Place this bowl into a larger bowl that has been filled with ice. Chill in the refrigerator for 15 minutes, but no longer - the terrific freshness of the fish will be lost.
Once chilled, remove the bowl from the ice, and invert onto a serving plate. Serve with toasted bread or your favorite crackers."
Quick and Easy Guacamole,"2  avocados - peeled, pitted, and diced, 2  green onions, chopped, 1 tablespoon chopped fresh cilantro, 1 teaspoon seasoned salt, 1 teaspoon ground black pepper, 1 teaspoon garlic, minced, Â½  lime, juiced","Combine avocado, green onion, cilantro, seasoned salt, black pepper, garlic, and lime juice in a bowl; mash with a spoon or potato masher until mostly smooth with small chunks."
Mexican Botana Platter,"2 pounds beef skirt steak, 2 pounds boneless chicken thighs, 2 teaspoons fajita seasoning, 2 Â½ teaspoons garlic powder, divided, 2 cups refried beans,   salt to taste,   lemon pepper to taste, 4  avocados - peeled, pitted, and mashed, 1 cup corn oil, 24  corn tortillas, 1 medium green bell pepper, chopped, 1 medium onion, chopped, â…?bunch cilantro, chopped, 1 (16 ounce) package shredded American cheese, 12 ounces sour cream, 2 large tomatoes, chopped, 4  pickled jalapeno peppers, sliced (Optional)","Preheat oven to 350 degrees F (175 degrees C).
Rub beef and chicken with fajita seasoning and 2 teaspoons garlic powder. Cut beef and chicken into 1-inch strips, and set aside.
In a saucepan, warm refried beans over medium-low heat.
Stir salt, lemon pepper, and 1/2 teaspoon garlic powder into mashed avocados. Set aside.
Heat corn oil in a deep skillet over medium-high heat. Cut tortillas in half, then cut in half again to make 4 triangular pieces per tortilla. Place into the skillet as many tortilla pieces as will fit without overlapping, and fry until crisp; repeat this process until all the tortilla pieces have been fried. Remove crisp tortillas to paper towels. Discard oil, and wipe out skillet.
Return skillet to medium heat, and stir in beef, chicken, bell pepper, and onion. Cook, stirring occasionally, about 7 minutes; then stir in cilantro.
Layer the tortilla pieces along the bottom of a large baking dish. Spread refried beans evenly over tortilla pieces. Sprinkle cheese over beans, then spread meat mixture evenly on top.
Bake in preheated oven until cheese and beans are bubbly, about 20 minutes. Remove from oven, and drop sour cream and guacamole by tablespoonfuls in various places across the top. Sprinkle tomatoes and jalapenos on top."
