recipe_name,ingredients,directions
Apple-Cranberry Crostada,"3 tablespoons butter, 2 pounds Granny Smith apples (or other firm, crisp apples), peeled, quartered, cored and sliced 1/4-inch thick, 1 pound Macintosh apples (or other soft-textured apples that fall apart when cooked), peeled, quartered, cored, and sliced 1/4-inch thick, Â½ cup sugar, Â½ cup dried cranberries, 1 sheet frozen puff pastry, thawed but still cold (follow package directions), 1  egg white, lightly beaten, 1 tablespoon sugar, 1 cup Optional: Ice cream or lightly sweetened whipped cream","Heat butter in a large skillet over medium-high heat. Add apples, 1/2 cup sugar and cranberries; cover and cook until apples release their liquid, about 5 minutes. Remove lid and continue to cook, stirring frequently, until soft apples fall apart and juices thicken to a thin-syrup consistency, about 5 minutes longer. Pour onto a large-lipped cookie sheet or jellyroll pan and cool to room temperature. (Can be refrigerated in an airtight container up to 5 days.)
Adjust oven rack to low position and heat oven to 400 degrees. Open puff pastry sheet on a lightly floured work surface. Roll into a rectangle, about 10 by 16 inches. Transfer to a large cookie sheet. (I suggest lining the sheet with parchment paper; this ensures the crostada doesn't stick and allows easy cleanup.)
Spread cooked apples over pastry, leaving a 2-inch border. Fold up pastry borders over apples. Unfold corners and form ruffled creases to keep dough from overlapping. Brush pastry border with egg white and sprinkle with the remaining 1 Tb. sugar. Bake until pastry is golden brown, 25 to 30 minutes. Serve warm or at room temperature with optional ice cream or whipped cream."
Apple Pie by Grandma Ople,"8 small Granny Smith apples, or as needed, Â½ cup unsalted butter, 3 tablespoons all-purpose flour, Â½ cup white sugar, Â½ cup packed brown sugar, Â¼ cup water, 1 (9 inch) double-crust pie pastry, thawed","Peel and core apples, then thinly slice. Set aside.
Preheat the oven to 425 degrees F (220 degrees C).
Melt butter in a saucepan over medium heat. Add flour and stir to form a paste; cook until fragrant, about 1 to 2 minutes. Add both sugars and water; bring to a boil. Reduce the heat to low and simmer for 3 to 5 minutes. Remove from the heat.
Press one pastry into the bottom and up the sides of a 9-inch pie pan. Roll out remaining pastry so it will overhang the pie by about 1/2 inch. Cut pastry into eight 1-inch strips.
Place sliced apples into the bottom crust, forming a slight mound. Lay four pastry strips vertically and evenly spaced over apples, using longer strips in the center and shorter strips at the edges.
Make a lattice crust: Fold the first and third strips all the way back so they're almost falling off the pie. Lay one of the unused strips perpendicularly over the second and fourth strips, then unfold the first and third strips back into their original position.
Fold the second and fourth vertical strips back. Lay one of the three unused strips perpendicularly over top. Unfold the second and fourth strips back into their original position.
Repeat Steps 6 and 7 to weave in the last two strips of pastry. Fold and trim excess dough at the edges as necessary, and pinch to secure.
Slowly and gently pour sugar-butter mixture over lattice crust, making sure it seeps over sliced apples. Brush some onto lattice, but make sure it doesn't run off the sides.
Bake in the preheated oven for 15 minutes. Reduce the temperature to 350 degrees F (175 degrees C) and continue baking until apples are soft, 35 to 45 minutes.











Natalie T
"
Sarah's Homemade Applesauce,"4  apples - peeled, cored and chopped, Â¾ cup water, Â¼ cup white sugar, Â½ teaspoon ground cinnamon","Combine apples, water, sugar, and cinnamon in a saucepan; cover and cook over medium heat until apples are soft, about 15 to 20 minutes.
Allow apple mixture to cool, then mash with a fork or potato masher until it is the consistency you like.











Photo by cookin'mama.
cookin mama
"
Apple Crisp,"10 cups all-purpose apples, peeled, cored and sliced, 1 cup white sugar, 1 tablespoon all-purpose flour, 1 teaspoon ground cinnamon, Â½ cup water, 1 cup quick-cooking oats, 1 cup all-purpose flour, 1 cup packed brown sugar, Â¼ teaspoon baking powder, Â¼ teaspoon baking soda, Â½ cup butter, melted","Preheat the oven to 350 degrees F (175 degrees C).
Place sliced apples in a 9x13-inch baking dish. Mix white sugar, 1 tablespoon flour, and cinnamon together; sprinkle over apples. Pour water evenly over apples.
Combine oats, 1 cup flour, brown sugar, baking powder, and baking soda in a large bowl. Add melted butter and mix with a fork until crumbly; sprinkle evenly over apple mixture.
Bake in the preheated oven until top is golden brown and apples are bubbling around the edges, about 45 minutes.











Dotdash Meredith Food Studios
"
Apple Pie Filling,"18 cups thinly sliced apples, 3 tablespoons lemon juice, 10 cups water, 4 Â½ cups white sugar, 1 cup cornstarch, 2 teaspoons ground cinnamon, 1 teaspoon salt, Â¼ teaspoon ground nutmeg","Toss apples with lemon juice in a large bowl and set aside.
Pour water into a Dutch oven over medium heat. Combine sugar, cornstarch, cinnamon, salt, and nutmeg in a bowl; add to water, stir well, and bring to a boil. Boil for 2 minutes, stirring constantly.
Add apples and return to a boil. Reduce heat, cover, and simmer until apples are tender, 6 to 8 minutes. Cool for 30 minutes.
Ladle into 5 freezer containers, leaving 1/2 inch of headspace. Cool at room temperature no longer than 1 1/2 hours.
Seal and freeze. Can be stored for up to 12 months.











Dotdash Meredith Food Studios
"
Easy Apple Crisp with Oat Topping,"6  apples - peeled, cored, and sliced, 2 tablespoons white sugar, 1 Â½ teaspoons ground cinnamon, divided, 1 cup brown sugar, Â¾ cup old-fashioned oats, Â¾ cup all-purpose flour, Â½ cup cold butter","Preheat the oven to 350 degrees F (175 degrees C).
Toss apples with white sugar and 1/2 teaspoon cinnamon in a medium bowl to coat; pour into a 9-inch square baking dish.
Mix brown sugar, oats, flour, and 1 teaspoon cinnamon in a separate bowl. Cut in cold butter with 2 knives or a pastry blender until the mixture resembles coarse crumbs; spread over apples and pat down gently until even.
Bake in the preheated oven until golden brown and sides are bubbling, about 40 minutes.









"
Easy Apple Cider,"1 (64 fluid ounce) bottle apple cider, 3  cinnamon sticks, 1 teaspoon whole allspice, 1 teaspoon whole cloves, â…?cup brown sugar","Combine apple cider and cinnamon sticks in a slow cooker.
Place allspice and cloves onto the center of an 8-inch square piece of cheesecloth. Gather edges of the cheesecloth together and tie to secure; place in the slow cooker. Stir in brown sugar. Cook on High until it comes to a boil. Reduce heat to Low and keep warm."
Apple-Cranberry Crisp,"2 pounds Granny Smith apples - peeled, cored and thinly sliced, Â¾ cup cranberries, Â¼ cup white sugar, 1 tablespoon ground cinnamon, 1 teaspoon ground nutmeg","Preheat the oven to 375 degrees F (190 degrees C.) Butter an 8-inch square baking dish.
Mix apples, cranberries, white sugar, cinnamon, and nutmeg in a large bowl. Place in an even layer in the prepared baking dish.
In the same bowl, combine oats, flour, and brown sugar for topping. Add butter pieces and mix with a fork until crumbly. Stir in pecans. Sprinkle topping over apples in the baking dish.
Bake in the preheated oven until apples are tender and topping is golden brown, 40 to 50 minutes."
Old-Fashioned Apple Dumplings,"1 recipe pastry for double-crust pie, 6 large Granny Smith apples, peeled and cored, Â½ cup butter, Â¾ cup brown sugar, 1 teaspoon ground cinnamon, Â½ teaspoon ground nutmeg, 3 cups water, 2 cups white sugar, 1 teaspoon vanilla extract","Preheat the oven to 400 degrees F (200 degrees C). Butter a 9x13-inch pan.
Roll pastry into a 24x16-inch rectangle on a lightly floured surface. Cut into six 8-inch squares. Place an apple on each pastry square with the cored opening facing upward. Cut butter into 8 pieces; place 1 piece in the opening of each apple; reserve the remaining butter for sauce.
Divide brown sugar between apples, poking some inside each cored opening and the rest around the base of each apple. Sprinkle cinnamon and nutmeg over apples.
Using slightly wet fingertips, bring one corner of the pastry square up to the top of the apple, then bring the opposite corner to the top and press together. Bring up the two remaining corners, and seal. Slightly pinch the dough at the sides to completely seal in the apple. Repeat with the remaining apples and place in the prepared baking dish.
Combine water, white sugar, vanilla extract, and reserved butter in a large saucepan. Place over medium heat, and bring to a boil. Reduce the heat to low and simmer until sugar is dissolved, about 5 minutes. Carefully pour the sauce over the dumplings.
Bake in the preheated oven for 50 to 60 minutes. Place each apple dumpling in a dessert bowl, and spoon some of the sauce over the top."
Southern Fried Apples,"Â½ cup butter, Â½ cup white sugar, 2 tablespoons ground cinnamon, 4  Granny Smith apples - peeled, cored, and sliced","Melt butter in a large skillet over medium heat. Add sugar and cinnamon; stir until sugar dissolves.
Add apples and cook until softened, 5 to 8 minutes.











Melissa Goff
"
Apple Turnovers,"2 tablespoons lemon juice, 4 cups water, 4  Granny Smith apples - peeled, cored and sliced, 2 tablespoons butter, 1 cup brown sugar, 1 teaspoon ground cinnamon, 1 tablespoon cornstarch, 1 tablespoon water, 1 (17.25 ounce) package frozen puff pastry sheets, thawed, 1 cup confectioners' sugar, 1 tablespoon milk, 1 teaspoon vanilla extract","Combine the lemon and 4 cups water in a large bowl. Place the sliced apples in the water to keep them from browning.
Melt butter in a large skillet over medium heat. Drain water from apples, and place them into the hot skillet. Cook and stir for about 2 minutes. Add brown sugar, and cinnamon, and cook, stirring, for 2 more minutes. Stir together cornstarch and 1 tablespoon water. Pour into the skillet, and mix well. Cook for another minute, or until sauce has thickened. Remove from heat to cool slightly.
Preheat the oven to 400 degrees F (200 degrees C).
Unfold puff pastry sheets, and repair any cracks by pressing them back together. Trim each sheet into a square. Then cut each larger square into 4 smaller squares. Spoon apples onto the center of each squares. Fold over from corner to corner into a triangle shape, and press edges together to seal. Place turnovers on a baking sheet, leaving about 1 inch between them.
Bake for 25 minutes in the preheated oven, until turnovers are puffed and lightly browned. Cool completely before glazing.
To make the glaze, mix together the confectioners' sugar, milk and vanilla in a small bowl. Adjust the thickness by adding more sugar or milk if necessary. Drizzle glaze over the cooled turnovers.











Dotdash Meredith Food Studios
"
Apple Crisp - Perfect and Easy,"2 Â½ cups apples - peeled, cored, and sliced, 1 cup sifted all-purpose flour, 1 cup white sugar, Â½ teaspoon ground cinnamon, Â¼ teaspoon salt, Â½ cup butter, softened","Preheat the oven to 375 degrees F (190 degrees C). Lightly grease an 8-inch square baking dish.
Arrange apple slices evenly in the prepared baking dish. Sift flour, sugar, cinnamon, and salt into a bowl. Cut in butter using a pastry blender, or 2 knives, until mixture resembles coarse cornmeal; sprinkle over apples.
Bake in the preheated oven until topping is golden, 40 to 45 minutes. Cool slightly before serving.











naples34102
"
The Best Caramel Apples,"8 large tart apples, 8  wooden chopsticks for handles, 2 cups packed brown sugar, 1 (14 ounce) can sweetened condensed milk, 1 cup light corn syrup, 1 cup butter, 2 teaspoons vanilla extract","Bring a large saucepan of water to a boil. Dip apples in boiling water for a few seconds, using a slotted spoon, then dry with paper towels to remove any wax from the peels. Set apples aside to cool completely, about 30 minutes.
Insert sticks into the bottom of each cooled apple through the core for a handle.
Line a baking sheet with parchment paper.
Stir brown sugar, sweetened condensed milk, corn syrup, and butter together in a saucepan over medium-high heat. Bring to a boil, stirring constantly, then reduce heat to medium. Cook until a candy thermometer reads 248 degrees F (120 degrees C), stirring constantly to prevent burning, about 25 to 30 minutes. A teaspoon of caramel dropped in a glass of cold water, should form a firm ball. Remove caramel from heat and stir in vanilla extract.
Working quickly, dip each apple into the hot caramel to completely coat the apple and about 1/2 inch of the wooden handle. Sprinkle apples with any desired toppings while still hot. Let caramel apples cool on the prepared baking sheet, about 1 hour. Use caution, caramel is very hot."
Mulligatawny Soup,"Â½ cup chopped onion, 2 stalks celery, chopped, 1  carrot, diced, Â¼ cup butter, 1 Â½ tablespoons all-purpose flour, 1 Â½ teaspoons curry powder, 4 cups chicken broth, Â½  apple, cored and chopped, Â¼ cup white rice, 1  skinless, boneless chicken breast half - cut into cubes, 1 pinch dried thyme,   salt and ground black pepper to taste, Â½ cup heavy cream, heated","Melt butter in a large soup pot over medium heat. Add onions, celery, and carrot and sautÃ© until soft, 5 to 7 minutes. Add flour and curry, and cook 5 more minutes, stirring frequently. Add chicken broth, mix well, and bring to a boil. Reduce heat and simmer for about 30 minutes.
Add apple, rice, chicken, thyme, salt, and pepper. Simmer until rice is tender, 15 to 20 minutes.
Just before serving, stir in hot cream.











TheBritishBaker
"
Sauteed Apples,"Â¼ cup butter, 4 large tart apples - peeled, cored and sliced 1/4 inch thick, Â½ cup cold water, 2 teaspoons cornstarch, Â½ cup brown sugar, Â½ teaspoon ground cinnamon","Melt butter in a large skillet or saucepan over medium heat; add apples and cook, stirring constantly, until almost tender, 6 to 7 minutes.
Mix water and cornstarch together in a small bowl until cornstarch is dissolved; pour over apples. Stir in brown sugar and cinnamon. Bring to a boil for 2 minutes, stirring occasionally. Remove from heat and serve warm.











dotdash meredith food studios
"
Homemade Apple Cider,"10 large apples, quartered,   water, to cover, Â¾ cup white sugar, 1 tablespoon ground cinnamon, 1 tablespoon ground allspice","Place apples in a large stockpot; cover with water by at least 2 inches. Stir in sugar, cinnamon, and allspice. Bring to a boil over medium-high heat. Boil, uncovered, for 1 hour. Reduce heat; cover and simmer for 2 hours.
Strain apple mixture through a fine-mesh sieve; discard solids. Drain cider again through a cheesecloth-lined sieve.
Refrigerate cider until cold, about 4 hours.











 LaDonna Langwell 
"
Canned Apple Pie Filling,"4 Â½ cups white sugar, 1 cup cornstarch, 2 teaspoons ground cinnamon, Â¼ teaspoon ground nutmeg, 10 cups water, 2 teaspoons salt, 3 tablespoons lemon juice, 2 drops yellow food coloring, 6 pounds apples","Mix sugar, cornstarch, cinnamon, and nutmeg in a large pan. Add water and salt and mix well. Bring to a boil and cook until thick and bubbly. Remove from heat and add lemon juice and food coloring.
Sterilize canning jars, lids, and rings by boiling them in a large pot of water.
Peel, core, and slice apples. Pack the sliced apples into hot canning jars, leaving a 1/2 inch of headspace.
Fill jars with hot syrup, and gently remove air bubbles with a knife.
Put lids on and process in a water bath canner for 20 minutes."
Easy Apple Pie,"1 (14.1 ounce) package pastry for a 9-inch double-crust pie, Â¾ cup white sugar, or more to taste, 1 teaspoon ground cinnamon, 6 cups thinly sliced apples, 1 tablespoon butter","Preheat the oven to 450 degrees F (230 degrees C).
Line a 9-inch pie dish with one pastry crust; set second one aside.
Combine 3/4 cup sugar and cinnamon in a small bowl. Add more sugar if your apples are tart.
Layer apple slices in the prepared pie dish, sprinkling each layer with cinnamon-sugar mixture. Dot top layer with small pieces of butter. Cover with top crust.
Bake pie on the lowest rack of the preheated oven for 10 minutes. Reduce oven temperature to 350 degrees F (175 degrees C) and continue baking until golden brown and filling bubbles, 30 to 35 minutes more. Serve warm or cold.











dotdash meredith food studios
"
Apple Crumb Pie,"6 cups thinly sliced apples, 1 tablespoon lemon juice (Optional), Â¾ cup white sugar, 2 tablespoons all-purpose flour, Â½ teaspoon ground cinnamon, â…?teaspoon ground nutmeg, Â½ cup raisins (Optional), Â½ cup chopped walnuts (Optional), 1 (9 inch) pie shell, Â½ cup all-purpose flour, Â½ cup packed brown sugar, 3 tablespoons butter","Preheat the oven to 375 degrees F (190 degrees C).
Place sliced apples in a large bowl; sprinkle with lemon juice. Mix white sugar, 2 tablespoons flour, cinnamon, and nutmeg together in a small bowl; sprinkle mixture over apples and toss until evenly coated. Stir in raisins and walnuts; transfer mixture into pie shell.
Mix 1/2 cup flour and brown sugar together in a small bowl. Blend in butter with a fork until mixture is crumbly; sprinkle over apple filling. Cover top of pie loosely with aluminum foil.
Bake in the preheated oven for 25 minutes. Remove foil and bake until top is golden brown and filling is bubbly, about 25 to 30 minutes more. Cool on a wire rack before serving."
Caramel Apples,"6  apples, 6  wooden craft sticks,   cooking spray, 1 (14 ounce) package individually wrapped caramels, unwrapped, 2 tablespoons milk","Remove the stem from each apple and press a craft stick into the top. Spray a baking sheet with cooking spray.
Place caramels and milk in a microwave-safe bowl; microwave for 2 minutes, stirring once. Set aside to cool briefly.
Roll each apple quickly in caramel sauce until well coated. Place on prepared sheet to set.









"
German Apple Cake,"1 cup vegetable oil, 2  eggs, 2 cups white sugar, 1 teaspoon vanilla extract, 2 cups all-purpose flour, 2 teaspoons ground cinnamon, 1 teaspoon baking soda, Â½ teaspoon salt, 4 cups apples - peeled, cored and diced","Preheat the oven to 350 degrees F (175 degrees C). Grease and flour a 9x13-inch cake pan.
Beat oil and eggs in a mixing bowl with an electric mixer until creamy. Add sugar and vanilla; beat well.
Stir together flour, cinnamon, baking soda, and salt in a bowl. Slowly add flour mixture to egg mixture; mix until combined. The batter will be very thick. Fold in apples by hand using a wooden spoon. Spread batter into the prepared pan.
Bake cake in the preheated oven until a toothpick inserted into the center comes out clean, about 45 minutes. Cool cake on a wire rack."
"Awesome Sausage, Apple and Cranberry Stuffing","3 Â¾ cups cubed white bread, 1 Â½ cups cubed whole wheat bread, 1 pound ground turkey sausage, 1 cup chopped onion, Â¾ cup chopped celery, 2 Â½ teaspoons dried sage, 1 Â½ teaspoons dried rosemary, Â½ teaspoon dried thyme, 1  Golden Delicious apple, cored and chopped, Â¾ cup dried cranberries, â…?cup minced fresh parsley, 1  cooked turkey liver, finely chopped, Â¾ cup turkey stock, 4 tablespoons unsalted butter, melted","Preheat the oven to 350 degrees F (175 degrees C).
Spread white and whole wheat bread cubes in a single layer on a large baking sheet.
Bake in the preheated oven until evenly toasted, 5 to 7 minutes. Transfer toasted bread cubes to a large bowl.
Cook sausage and onions in a large skillet over medium heat, stirring and breaking up lumps, until evenly browned, 6 to 8 minutes. Add celery, sage, rosemary, and thyme; cook and stir until flavors blend, about 2 minutes.
Pour sausage mixture over bread in bowl. Mix in chopped apple, dried cranberries, parsley, and liver. Drizzle with turkey stock and melted butter; mix lightly.
Allow stuffing to cool completely before loosely stuffing a turkey.











Dotdash Meredith Food Studios
"
Apple Hand Pies,"2 tablespoons butter, 2 large green apples - peeled, cored, and cut into chunks, 2 tablespoons brown sugar, Â¼ cup white sugar, Â¼ teaspoon salt, 1 Â½ teaspoons ground cinnamon, or to taste, 1 teaspoon water, or more if needed (Optional), 1 pound prepared pie dough, cut into 4 pieces, 1  egg, 2 teaspoons milk, 1 teaspoon white sugar, or as needed","Melt butter in a large skillet over medium heat; let butter brown to a light golden color and smell toasted, about 1 minute. Stir apples into hot butter; sprinkle with 1/4 cup white sugar, brown sugar, and salt. Cook and stir apple mixture until apples are softened, about 5 minutes. Mix in cinnamon and water; continue cooking until apples are soft and sticky, 1 to 2 more minutes. Spread apple filling onto a plate to cool.
Preheat the oven to 400 degrees F (200 degrees C). Line a baking sheet with a silicone mat or parchment paper.
Form a dough piece into a ball, place on a floured work surface, and roll into a circle about 8 inches in diameter. Spoon 1/3 to 1/2 cup apple filling in the center. Fold dough over filling, leaving about 1 inch of dough on the bottom side visible below the top side. Gently press dough closed around filling, using your fingertips.
Fold the overhanging bottom part of dough up over the top edge, working your way around the crust, and pinch the overhang tightly to the top part of the crust.
Crimp the edge tightly closed, pinching a little bit of dough with the thumb and forefinger of one hand and using your index finger on the other hand to push a small notch into the pinched dough. Continue pinching and notching all the way around until crust is tightly crimped together. Repeat with remaining dough and filling. Transfer pies onto prepared baking sheet.
Whisk egg with milk in a small bowl until thoroughly combined. Brush top of each hand pie with egg mixture and sprinkle with about 1/4 teaspoon white sugar. Cut 3 small vent holes in the top of each pie.
Bake in the preheated oven until pies are golden brown and filling is bubbling, 25 to 30 minutes. Let cool for at least 15 minutes before serving.











Dotdash Meredith Food Studios
"
Amazing Apple Butter,"10 pounds apples, quartered, 4 cups unsweetened apple juice, 1 cup white sugar, 1 tablespoon apple cider vinegar, 1 Â½ teaspoons ground cinnamon, Â½ teaspoon ground cloves, Â½ teaspoon ground allspice, 6  half-pint canning jars with lids and rings","Combine apples and apple juice in a stockpot; bring to a boil. Reduce heat and cook at a simmer until apples are soft and mushy, 20 to 30 minutes.
Spoon apples into a food mill and process into puree while discarding the cores and peels remaining in the mill. Transfer process apples to a slow cooker.
Cook on High with the lid off until the moisture evaporates and the volume reduces by about half, overnight to 24 hours.
Stir sugar, apple cider vinegar, cinnamon, cloves, and allspice through the apple puree.
Continue cooking on High until mixture mounds on a chilled plate without any water separating from the edges, another 2 to 6 hours.
Sterilize the jars and lids in boiling water for at least 5 minutes. Pack the apple butter into the hot, sterilized jars, filling the jars to within 1/4 inch of the top. Run a knife or a thin spatula around the insides of the jars after they have been filled to remove any air bubbles. Wipe the rims of the jars with a moist paper towel to remove any food residue. Top with lids, and screw on rings.
Place a rack in the bottom of a large stockpot and fill halfway with water. Bring to a boil and lower jars into the boiling water using a holder. Leave a 2-inch space between the jars. Pour in more boiling water if necessary to bring the water level to at least 1 inch above the tops of the jars. Bring the water to a rolling boil, cover the pot, and process 5 to 10 minutes.
Remove the jars from the stockpot and place onto a cloth-covered or wood surface, several inches apart, until cool. Once cool, press the top of each lid with a finger, ensuring that the seal is tight (lid does not move up or down at all). Store in a cool, dark area."
Easy Apple Cinnamon Muffins,"1 Â½ cups all-purpose flour, Â¾ cup white sugar, 2 teaspoons baking powder, 1 teaspoon ground cinnamon, Â½ teaspoon salt, 1  egg, â…?cup vegetable oil, â…?cup milk, 2  apples - peeled, cored and chopped","Preheat the oven to 400 degrees F (200 degrees C). Grease 6 large muffin cups or line with paper muffin liners.
Make muffins: Stir together flour, sugar, baking powder, cinnamon, and salt in a large bowl. Mix in egg, oil, and milk. Fold in chopped apples. Spoon batter into the prepared muffin cups, filling just below the rim.
Make topping: Place sugar, butter, flour, and cinnamon into a small bowl; mash mixture with a fork and sprinkle over unbaked muffins.
Bake in the preheated oven until a toothpick inserted into the center of a muffin comes out clean, 20 to 25 minutes.











Kelly McCulley
"
